hcp_name,num_articles,title,authors,journal,publication_year,abstract,hcp_name_short,scraped_from
Sofia Wikström,24,extensive spread farmed seaweeds causes shift native nonnative haplotypes natural seaweed beds,"S Tano, C Halling, E Lind, A Buriyo, S Wikström",marine biology,2015.0,"seaweed farming cause introductions non-indigenous seaweed species genotypes world. in zanzibar, tanzania, foreign genotypes eucheuma denticulatum introduced farming purposes 1989, recent years spread",S Wikström,gs
Sofia Wikström,24,effects water exchange vegetation macroinvertebrate fauna composition shallow landuplift bays baltic sea,"J Hansen, S Wikström, L Kautsky","estuarine, coastal and shelf science",2008.0,"shallow bays soft sediment bottoms common habitats swedish finnish baltic sea coastline. these bays undergo process geomorphometric evolution natural isostatic land-uplift process, open bays sounds decrease depth",S Wikström,gs
Sofia Wikström,24,effects plant morphology smallscale distribution invertebrates,"J Hansen, J Sagerman, S Wikström",marine biology,2010.0,"habitat structure influences organism communities mediating interactions individuals species, affecting abundance species richness. we examined variations morphology soft-bottom plants affect function habitat",S Wikström,gs
Sofia Wikström,24,higher resistance herbivory introduced compared native populations seaweed,"H Forslund, S Wikström, H Pavia",oecologia,2010.0,"non-indigenous species (nis) important components global change, order manage species important understand factors affect success. interactions enemies new range shown important outcome",S Wikström,gs
Sofia Wikström,24,effekter av bottentrålning på ekosystemtjänster svenska hav,"S Wikström, M Blomqvist, H AB",havsmiljöinstitutet rapport,2018.0,bottentrålsfiske ger omfattande effekter på marina ekosystem och ekosystemprocesser. i rapporten redovisar vi det kunskapsunderlag som finns vad gäller effekterna av trålning på havets ekosystem och ekosystemtjänster vi får från havet. vårt syfte med studien har därför,S Wikström,gs
Sofia Wikström,24,fouling mediates grazing intertwining resistances multiple enemies brown alga fucus vesiculosus,"V Jormalainen, S Wikström, T Honkanen",oecologia,2008.0,"macroalgae cope multiple natural enemies, herbivores epibionts. as harmful host, host expected resistance them. evolution resistance complicated interactions enemies genetic",S Wikström,gs
Sofia Wikström,24,establishment exotic species fucus evanescens c agphaeophyceae öresund southern sweden,"S Wikström, T Wachenfeldt, L Kautsky",,2002.0,"the spread establishment exotic species fucus evanescens öresund, southern sweden documented inventories 1966–72 2000. the species spread fast known introduction 1955, colonising harbours coast. after",S Wikström,gs
Sofia Wikström,24,letter editor kotta et al 2020 cleaning seas blue growth initiatives mussel farming eutrophication control baltic sea,"S Wikström, N Hedberg, N Kautsky",science of the total,2020.0,"this pdf file article undergone enhancements acceptance, addition cover page metadata, formatting readability, definitive version record. this version undergo additional copyediting, typesetting",S Wikström,gs
Sofia Wikström,24,taxon composition foodweb structure morphometric gradient baltic sea landuplift bays,"J Hansen, S Wikström, L Kautsky",,2012.0,shallow baltic sea bays undergo process morphometric isolation sea post-glacial land uplift. recent studies documented flora fauna communities change gradient. changes taxon composition turn alter feeding,S Wikström,gs
Sofia Wikström,24,var finns den frilevande blåstången,"E Schagerström, S Qvarfordt, S Wikström",svensk botanisk tidskrift,2020.0,"brunalgen blåstång fucus vesiculosus är en karaktärsart för östersjön. den dominerar grunda hårda bottnar nästan hela östersjön och flesta känner väl igen den på den breda, guldbruna bålen och luftblåsorna som håller den upprätt vattnet. men det finns också en",S Wikström,gs
Sofia Wikström,24,divergent ecological strategies determine different impacts community production successful nonnative seaweeds,"J Sagerman, S Enge, H Pavia, S Wikström",oecologia,2014.0,"the consequences plant introductions ecosystems frequently reported terrestrial environments, little known effects ecosystem functioning caused non-native primary producers marine systems. in study explored effects",S Wikström,gs
Lena Westerberg,3,working conditions family situation relation functional gastrointestinal disorders the swedish dyspepsia project,"L Westerberg, T Theorell",scandinavian journal of primary health,1997.0,"objective-to examine improvement and/or deterioration functional gastrointestinal symptoms relate psychosocial factors, patients symptoms special characteristics regard working environment comparison referent",L Westerberg,gs
Lena Westerberg,3,det rika barnet tio förskollärares uppfattningar om barns lärande reggio emiliainspirerade förskolor,"M Perzon, L Westerberg",,2007.0,"syftet med detta examensarbete är att undersöka förskollärares uppfattningar om barns lärande reggio emiliainspirerade förskolor. vi har undersökt vad förskollärare säger om barns lärande, samt vilka principer har som utgångspunkter. vår teoretiska utgångspunkt är",L Westerberg,gs
Lena Westerberg,3,hälsofrämjande beteende utanför arbetstid en attitydundersökning på studerande med arbetslivserfarenhet jämtland,"L Westerberg, A Wikman",,2015.0,,L Westerberg,gs
Eva Lindblad,4,livet som doktorand vid linköpings universitet resultat från en enkätundersökning våren 2004,"K Andersson, E Lindblad, K Blume, U Nilsson",,2005.0,i maj 2004 genomfördes en enkätundersökning som riktades till alla doktorander vid linköpings universitet. de frågeområden som enkäten behandlade inkluderade doktorandens bakgrund och nuvarande status; handledningssituationen samt forsknings-och arbetsmiljö;,E Lindblad,gs
Eva Lindblad,4,dagkirurgisk laparoscopisk cholecystectomi ur ett patientperspektiv,"M Fransson, E Lindblad",,2008.0,introduktion till yrket är vi narkossjuksköterska och operationssjuksköterska. på det sjukhus vi arbetar är flesta patienterna inneliggande på vårdavdelning ca två till tre dagar samband med att skall få gallblåsan borttagen med laparoscopisk titthålsteknik. det är väl känt,E Lindblad,gs
Eva Lindblad,4,arbetsdelning och delat arbete om förändring för kvinnor och män industi,"E Cedersund, E Chiriac, E Lindblad",,1995.0,,E Lindblad,gs
Eva Lindblad,4,kompetensutveckling forskargrupper ett av arbetslivsfonden stött projekt,"B Kågedal, E Lindblad, A Bjuremark",,1995.0,,E Lindblad,gs
Liselott Sahlberg,1,översättning och kulturell anpassning av bedömningsinstrumentet malignant wound assessment toolclinical version mwatc till svenska ,"L Sahlberg, M Eriksson","onkologidagarna, 19–22",2018.0,,L Sahlberg,gs
Per Nodbrant,1,lean för kortare väntetid till strålbehandling förbättringsarbete och enkätstudie hur det påverkar arbetsmiljön,P Nodbrant,,2014.0,bakgrund: tumörsjukdomar utgör ett allvarligt folkhälsoproblem. strålbehandling är ett av behandlingsalternativen. för att öka sannolikheten för bot och/eller lindring är det viktigt att tiden från misstänkt diagnos till behandlingsbeslut respektive behandlingsstart är kort. i syfte att,P Nodbrant,gs
Marie Johansson,20,alteration intestinal microflora associated reduction abdominal bloating pain patients irritable bowel syndrome,"S Nobaek, M Johansson, G Molin, S Ahrné",the american journal of,2000.0,"objective: the influence gastrointestinal (gi) microflora patients irritable bowel syndrome (ibs) clearly elucidated. this study undertaken patients ibs imbalance normal colonic flora, bacterial taxa",M Johansson,gs
Marie Johansson,20,activation endosomal dynein motors stepwise assembly rab7rilpp150glued orp1l receptor βlll spectrin,"M Johansson, N Rocha, W Zwart, I Jordens",the journal of cell,2007.0,"the small gtpase rab7 controls late endocytic transport minus end–directed motor protein complex dynein–dynactin, unclear. rab7-interacting lysosomal protein (rilp) oxysterol-binding protein–related protein 1l (orp1l) effectors",M Johansson,gs
Marie Johansson,20,effect lactobacillus plantarum 299v cardiovascular disease risk factors smokers,"M Naruszewicz, M Johansson",american journal of,2002.0,"background: the short-chain fatty acids formed human colon bacterial fermentation fiber antiinflammatory effect, reduce insulin production, improve lipid metabolism. we previously showed hypercholesterolemic patients",M Johansson,gs
Marie Johansson,20,a mannosespecific adherence mechanism lactobacillus plantarum conferring binding human colonic cell line ht29,"I Adlerberth, S Ahrne, M Johansson",applied and,1996.0,"two lactobacillus plantarum strains human intestinal origin, strains 299 (= dsm 6595) 299v (= dsm 9843), proved efficient colonizers human intestine experimental conditions. these strains 17 l. plantarum strains tested",M Johansson,gs
Marie Johansson,20,the oxysterolbinding protein homologue orp1l interacts rab7 alters functional properties late endocytic compartments,"M Johansson, M Lehto, K Tanhuanpää",molecular biology of,2005.0,"orp1l member human oxysterol-binding protein (osbp) family. orp1l localizes late endosomes (les)/lysosomes, colocalizing gtpases rab7 rab9 lysosome-associated membrane protein-1. we demonstrate orp1l interacts physically",M Johansson,gs
Marie Johansson,20,the osbprelated protein family humans,"M Lehto, S Laitinen, G Chinetti, M Johansson",journal of lipid,2001.0,"oxysterols oxygenated derivatives cholesterol number biological effects play key role maintenance body cholesterol balance. in study, cdna sequences genomic structures recently identified human oxysterol…",M Johansson,gs
Marie Johansson,20,impairment bacterial flora human ulcerative colitis experimental colitis rat,"R Fabia, A ArRajab, M Johansson, R Andersson",digestion,1993.0,"changes colonic mucosa-associated microflora determinated patients active inactive ulcerative colitis rats acetic acid-induced colitis. in patients active ulcerative colitis, significant decreases number anaerobic bacteria (brain",M Johansson,gs
Marie Johansson,20,integration telencephalic wnt hedgehog signaling center activities foxg1,"C Danesin, J Peres, M Johansson, V Snowden",developmental cell,2009.0,"the forebrain patterned dorsoventral (dv) axis sonic hedgehog (shh). however, previous studies suggested presence shh-independent mechanism. our study identifies wnt/β-catenin—activated telencephalic roof—as shh-…",M Johansson,gs
Marie Johansson,20,the variants oxysterol binding proteinrelated protein1 display different tissue expression patterns different intracellular localization functionally ,"M Johansson, V Bocher, M Lehto",molecular biology of,2003.0,"oxysterol binding protein (osbp) homologs comprise family 12 proteins humans ( jaworski et al., 2001 ; lehtoet al., 2001 ). two variants osbp-related protein (orp) 1 identified: short consists carboxy-terminal ligand binding domain (…",M Johansson,gs
Marie Johansson,20,genetic analysis crimeancongo hemorrhagic fever virus iran,"S Chinikar, S Persson, M Johansson",journal of medical,2004.0,"crimean‐congo hemorrhagic fever (cchf) potentially fatal disease caused tick‐borne virus family bunyavridae. the disease occurs parts africa, asia, middle east, eastern europe. during recent years, increasing number human cchf cases",M Johansson,gs
Marie Johansson,20,positively negatively charged residues different effects position membrane model transmembrane helix,"M Monné, I Nilsson, M Johansson, N Elmhed",journal of molecular,1998.0,we studied effects single charged residues position model transmembrane helix endoplasmic reticulum membrane glycosylation mapping technique. asp glu residues cause re-positioning c-terminal end,M Johansson,gs
Marie Johansson,20,adhesion probiotic bacterium lactobacillus plantarum 299v gut mucosa critically ill patients randomised open trial,"B Klarin, M Johansson, G Molin, A Larsson",critical,2005.0,"to achieve possible positive effect intestinal mucosa cells important probiotics adhere tightly intestinal mucosa. it shown healthy volunteers lactobacillus plantarum 299v (lp 299v) (dsm 9843), probiotic bacterium, given orally",M Johansson,gs
Marie Johansson,20,dkk1 controls cellcell interaction regulation nonnuclear βcatenin pools,"M Johansson, F Giger, T Fielding, C Houart",developmental cell,2019.0,dickkopf-1 (dkk1) secreted wnt antagonist well-established role head induction development. numerous studies emerged implicating dkk1 malignancies neurodegenerative diseases unknown mechanism. using zebrafish,M Johansson,gs
Marie Johansson,20,distortion norway spruce timber part 1 variation relevant wood properties,"M Perstorper, M Johansson, R Kliger",holz als roh-und,2001.0,picea abies ) trees fast-grown slow-grown stand southern sweden. from trees 240 studs (45 × 70 × 2500 mm) taken measurement distortion. wood properties measured small specimens (13 × 13 × 200 mm) cut studs. spiral,M Johansson,gs
Marie Johansson,20,prediction timber bending strength basis bending stiffness material homogeneity assessed dynamic excitation,"A Olsson, J Oscarsson, M Johansson",wood science and,2012.0,"the potential utilizing resonance frequencies corresponding edgewise bending modes predicting bending strength timber investigated. the research includes measurements axial transversal resonance frequencies, laboratory assessment density,",M Johansson,gs
Marie Johansson,20,positively charged amino acids placed signal sequence block protein translocation efficiently escherichia coli mammalian microsomes,"M Johansson, I Nilsson, G Heijne",molecular and general genetics,1993.0,"positively charged amino acids known efficiently block protein secretion escherichia coli, placed short distance downstream signal sequence. it known applies protein secretion eukaryotic cells, statistical studies",M Johansson,gs
Marie Johansson,20,impact information letters reporting rate adverse drug reactions quality reports randomized controlled study,"M Johansson, S Hägg, S Wallerstedt",bmc clinical pharmacology,2011.0,"spontaneous reporting adverse drug reactions (adrs) important method pharmacovigilance, under-reporting poor quality reports major limitations. the aim study evaluate repeated one-page adr information letters affect (i)",M Johansson,gs
Marie Johansson,20,bending creep performance modified timber,"H Epmeier, M Johansson, R Kliger, M Westin",holz als roh-und werkstoff,2007.0,"the present study supplement epmeier kliger (2005), investigated effect different modification methods (acetylation, modification methylated melamine resin heat treatment vegetable oil) material properties (density, modulus",M Johansson,gs
Marie Johansson,20,material properties interrelation chemically modified clear wood scots pine,"H Epmeier, M Johansson, R Kliger, M Westin",,2007.0,the mechanical physical properties modified wood assessed experimentally. timber studs cross-section 45 mm×70 mm modified semi-industrial scale different methods: 1) acetylation (ac) acetic anhydride; 2) modification,M Johansson,gs
Marie Johansson,20,distortion norway spruce timber part 2 modelling twist,"M Johansson, M Perstorper, R Kliger",holz als roh-und,2001.0,"picea abies ). several material parameters measured, spiral grain angle, shrinkage directions, annual ring width density. twist studs measured different times different moisture contents. the twist correlated",M Johansson,gs
Sofie Dietl,1,medaljens baksida upplevelser hos elitidrottande kvinnor med ätstörningar,"S Dietl, H Stenman",,2009.0,"att vara elitidrottande kvinna innebär bland annat hård träning, kändisskap och psykisk påfrestning. all tid och alla tankar går till idrotten och det finns inget utrymme för någonting annat, speciellt inte för sjukdom. ett flertal elitidrottande kvinnor med ätstörningar har senaste",S Dietl,gs
Karin Nilsson,15,improvement cognitive functions cobalaminfolate supplementation elderly patients dementia elevated plasma homocysteine,"K Nilsson, L Gustafson",international journal of,2001.0,"objectives to investigate effect cobalamin/folate supplementation cognitive function elderly patients dementia. method the cobalamin/folate status patients evaluated measuring plasma homocysteine, serum methylmalonic acid, serum cobalamin",K Nilsson,gs
Karin Nilsson,15,increased bloodbrain barrier permeability associated dementia diabetes amyloid pathology apoe genotype,"S Janelidze, J Hertze, K Nägga, K Nilsson",neurobiology of,2017.0,"blood-brain barrier (bbb) dysfunction important component neurodegenerative disorders. in study, investigated role dementia large clinical cohorts. the cerebrospinal fluid (csf)/plasma albumin ratio (qalb), indicator bbb (and",K Nilsson,gs
Karin Nilsson,15,patient perspectives recovery adolescent onset anorexia nervosa,"K Nilsson, B Hägglöf",eating disorders,2006.0,"the aim qualitative study patients' perspective recovery process anorexia nervosa. on average 16 years initial assessment child adolescent psychiatric clinics, 68 women interviewed attributed important",K Nilsson,gs
Karin Nilsson,15,a longitudinal study perfectionism adolescent onset anorexia nervosarestricting type,"K Nilsson, E Sundbom, B Hägglöf",european eating disorders,2008.0,"this longitudinal study analyses self‐reported perfectionism, eating disorders psychiatric symptoms recovery anorexia nervosa (an). with recovered design, group 68 previous patients an studied follow‐up studies, 8 16 years 1st",K Nilsson,gs
Karin Nilsson,15,rspo3 important trabecular bone fracture risk mice humans,"K Nilsson, P Henning, M Shahawy",nature,2021.0,"with increasing age population, countries globe facing substantial increase osteoporotic fractures. genetic association signals fractures reported rspo3 locus, causal gene underlying mechanism unknown. here",K Nilsson,gs
Karin Nilsson,15,causes adolescent onset anorexia nervosa patient perspectives,"K Nilsson, E Abrahamsson, A Torbiornsson",eating,2007.0,this qualitative study describes perspectives anorexia nervosa (an) patients respect believed developed an. previous patients initial treatment child adolescent psychiatric clinics northern sweden interviewed 8 16,K Nilsson,gs
Karin Nilsson,15,parents experiences having caring child eating disorder,"E Svensson, K Nilsson, R Levi, N Suarez",eating disorders,2013.0,eating disorders (ed) conditions affect patients families. little known influence disorders family life swedish population ways affected families actually attempt cope. the aim study specifically,K Nilsson,gs
Karin Nilsson,15,the crystal structure tetrapyridine copper i perchlorate tetrapyridine silver i perchlorate 260 k,"K Nilsson, A Oskarsson",acta chem scand ser a phys inorg,1982.0,"the crystal structures [m (c5h5n) 4] c104, m= cu ag, determined x-ray intensity data collected 260 к cad-4 diffractometer. the compounds isostructural. the space group 14 z= 2; a= 12.471 (3), c= 6.894 (2) cu a=",K Nilsson,gs
Karin Nilsson,15,longterm followup adolescent onset anorexia nervosa northern sweden,"K Nilsson, B Hägglöf",review: the professional journal of the,2005.0,"objective this study examines long‐term outcome adolescent onset anorexia nervosa, 8 16 years admission child adolescent psychiatric (cap) treatment northern sweden. method two follow‐ups (1991 1999) 68 women",K Nilsson,gs
Karin Nilsson,15,orthostatic hypotension organic dementia relationship blood pressure cortical blood flow symptoms,"U Passant, S Warkentin, S Karlson, K Nilsson",clinical autonomic,1996.0,"regional cerebral blood flow measured 35 patients organic dementia (alzheimer's disease, n=13, vascular dementia, n=17, frontotemporal dementia, n=5) orthostatic hypotension. measurements performed supine rest head-up tilt (60).",K Nilsson,gs
Karin Nilsson,15,invasion success depends invader body size sizestructured mixed predationcompetition community,"A Schröder, K Nilsson, L Persson",journal of animal,2009.0,"the size individual important determinant trophic position type interactions engages heterospecific conspecific individuals. consequently individual’s ecological role community changes body size ontogeny,",K Nilsson,gs
Karin Nilsson,15,porcupine inhibitors impair trabecular cortical bone mass strength mice,"T Brentano, K Nilsson",journal of,2018.0,wnt signaling involved tumorigenesis cancers regulates bone homeostasis. palmitoleoylation wnts porcupine required wnt activity. porcupine inhibitors development cancer therapy. as possible effects porcupine,K Nilsson,gs
Karin Nilsson,15,inducible wnt16 inactivation wnt16 regulates cortical bone thickness adult mice,"C Ohlsson, P Henning, K Nilsson, J Wu",journal of,2018.0,"substantial progress therapeutic reduction vertebral fracture risk patients osteoporosis, non-vertebral fracture risk improved marginally. human genetic studies demonstrate wnt16 locus major determinant cortical",K Nilsson,gs
Karin Nilsson,15,relation plasma homocysteine alzheimers disease,"K Nilsson, L Gustafson, B Hultberg",dementia and geriatric cognitive,2002.0,"objective: several studies shown plasma total homocysteine (thcy) concentration elevated alzheimer’s disease (ad). however, clear elevated plasma thcy primary cause consequence ad. method: to elucidate question,",K Nilsson,gs
Karin Nilsson,15,the tau r406w mutation causes progressive presenile dementia bitemporal atrophy,"J Ostojic, C Elfgren, U Passant, K Nilsson",dementia and geriatric,2004.0,frontotemporal dementia (ftd) alzheimer’s disease (ad) frequent causes dementia share clinical neuropathological features. common disorders neurofibrillary tangles consisting aggregations hyperphosphorylated tau protein.,K Nilsson,gs
Marianne Pettersson,5,deltidsarbetet sverige,M Pettersson,"deltidsökningens orsaker, deltidsanställdas",1981.0,"… marianne pettersson hat samlat och presenterat ett mycket rikhaltigt material om deitidsarbe-te och deltidsarbetandes villkor. inte desto mindre ar, vad jag forstar, en stor del av orsaken till den infekteradc debatt som foljt pa rapportens publicering att marianne pettersson som",M Pettersson,gs
Marianne Pettersson,5,äggstockens normala storlek och struktur hos tik,M Pettersson,,2008.0,vid ultraljudsundersökning på tikens äggstockar krävs idag bättre referensvärden än vad som funnits tidigare för att kunna skilja ett normalt utseende från ett patologiskt. i denna studie studerades äggstockarna hos 50 gatuhundar som kastrerades vid två olika djursjukhus,M Pettersson,gs
Marianne Pettersson,5,lek med skrift förskolan flerspråkighet som kommunikativ resurs,"Å Wedin, M Pettersson, J Warström",,2019.0,,M Pettersson,gs
Marianne Pettersson,5,erottaminen naftaliini petrokemikaalit,M Pettersson,,1983.0,"erottaminen, naftaliini, petrokemikaalit erottaminen, naftaliini, petrokemikaalit | kirjaudu aaltodoc → 1b maisterivaiheen opinnäytetyöt / master’s theses → [dipl] teknillinen korkeakoulu / tkk → näytä viite erottaminen, naftaliini, petrokemikaalit nimeke: erottaminen, naftaliini, petrokemikaalit",M Pettersson,gs
Marianne Pettersson,5, nej det var ju inte alla muslimer som körde world trade centre religionsundervisningens värde avseende på högstadieelevers förhållningssätt till ,"S Eriksson, M Pettersson",,2002.0,"urn: urn: nbn: se: ltu: diva-57901 isrn: ltu-ped-ex--02/022--se local id: e863b89b-8e93-446b-9f43-5d64f44a7faa oai: oai: diva. org: ltu-57901 diva, id: diva2: 1031289",M Pettersson,gs
Lena Samuelsson,13,stress wellbeing parents children rare diseases a prospective intervention study,"L Dellve, L Samuelsson, A Tallborn",journal of advanced,2006.0,"aim. this paper reports study assess stress, well‐being supportive resources experienced mothers fathers children rare disabilities, variables affected intensive family competence intervention. background. despite diagnosis‐…",L Samuelsson,gs
Lena Samuelsson,13,psoriasis susceptibility locus chromosome region 3q21 identified patients southwest sweden,"F Enlund, L Samuelsson, C Enerbäck, A Inerot",european journal of,1999.0,we performed pair-wise linkage study search psoriasis susceptibility regions. a preliminary scan performed 20 families. in set obtained indications linkage chromosome 3q21. this region investigated material total,L Samuelsson,gs
Lena Samuelsson,13,mutations prosc disrupt cellular pyridoxal phosphate homeostasis cause vitaminb6dependent epilepsy,"N Darin, E Reid, L Prunetti, L Samuelsson",the american journal of,2016.0,"pyridoxal 5′-phosphate (plp), active form vitamin b 6 , functions cofactor humans 140 enzymes, involved neurotransmitter synthesis degradation. a deficiency plp present, therefore, seizures symptoms",L Samuelsson,gs
Lena Samuelsson,13,identification psoriasis susceptibility candidate gene linkage disequilibrium mapping localized single nucleotide polymorphism map,"D Hewett, L Samuelsson, J Polding, F Enlund, D Smart",genomics,2002.0,"psoriasis chronic inflammatory disease skin genetic environmental risk factors. here creation single-nucleotide polymorphism (snp) map spanning 900–1200 kb chromosome 3q21, previously recognized",L Samuelsson,gs
Lena Samuelsson,13,differential activation lungspecific genes two forkhead proteins freac1 freac2 ,"M Hellqvist, M Mahlapuu, L Samuelsson",journal of biological,1996.0,"we cdna sequences human transcription factors, forkhead related activator (freac)-1 −2, belong forkhead family eukaryotic dna binding proteins. freac-1 −2 encoded distinct genes, identical dna",L Samuelsson,gs
