title,title_link,authors,publications,snippet,hcp_name,num_articles
Risk factors for the development of albuminuria and renal impairment in type 2 diabetes—the Swedish National Diabetes Register (NDR),https://academic.oup.com/ndt/article-abstract/26/4/1236/1878919,"H Afghahi, J Cederholm, B Eliasson… ","Nephrology Dialysis …, 2011 ","Background . The aim of this study was to identify clinical risk factors associated with the 
development of albuminuria and renal impairment in patients with type 2 diabetes (T2D). In 
addition, we evaluated if different equations to estimate renal function had an impact on …",Maria Svensson,20
Signs of nephropathy may occur early in young adults with diabetes despite modern diabetes management: results from the nationwide population-based Diabetes …,https://care.diabetesjournals.org/content/26/10/2903.short,"M Svensson, G Sundkvist, HJ Arnqvist, E Björk… ","Diabetes …, 2003 ","OBJECTIVE—To estimate the occurrence of early-onset renal involvement in a nationwide 
population-based cohort of young adults with diabetes in Sweden and relate the findings to 
glycemic control, type of diabetes, sex, smoking, and blood pressure. RESEARCH DESIGN …",Maria Svensson,20
Distinct genomic aberrations associated with ERG rearranged prostate cancer,https://onlinelibrary.wiley.com/doi/abs/10.1002/gcc.20647,"F Demichelis, SR Setlur, R Beroukhim… ","Genes …, 2009 ","Emerging molecular and clinical data suggest that ETS fusion prostate cancer represents a 
distinct molecular subclass, driven most commonly by a hormonally regulated promoter and 
characterized by an aggressive natural history. The study of the genomic landscape of …",Maria Svensson,20
A functional polymorphism in the manganese superoxide dismutase gene and diabetic nephropathy,https://diabetes.diabetesjournals.org/content/56/1/265.short,"A Möllsten, SL Marklund, M Wessman, M Svensson… ","Diabetes, 2007 ","Oxidative stress has been suggested to contribute to the development of diabetic nephropathy. 
Manganese superoxide dismutase (MnSOD) protects the cells from oxidative damage by 
scavenging free radicals. The demand for antioxidants is increased by smoking, which could …",Maria Svensson,20
Age at onset of childhood-onset type 1 diabetes and the development of end-stage renal disease: a nationwide population-based study,https://care.diabetesjournals.org/content/29/3/538.short,"M Svensson, L Nyström, S Schön, G Dahlquist ","Diabetes care, 2006 ","OBJECTIVE—To analyze the impact of age at onset on the development of end-stage renal 
disease (ESRD) due to diabetic nephropathy in a nationwide population-based cohort with 
childhood-onset type 1 diabetes. RESEARCH DESIGN AND METHODS—A record linkage …",Maria Svensson,20
"Hydrochlorothiazide, but not Candesartan, aggravates insulin resistance and causes visceral and hepatic fat accumulation: the mechanisms for the diabetes …",https://www.ahajournals.org/doi/abs/10.1161/HYPERTENSIONAHA.108.119404,"JW Eriksson, PA Jansson, B Carlberg, A Hägg… ","…, 2008 ","Treatment with angiotensin II receptor blockers is associated with lower risk for the development 
of type 2 diabetes mellitus compared with thiazide diuretics. The Mechanisms for the 
Diabetes Preventing Effect of Candesartan Study addressed insulin action and secretion and …",Maria Svensson,20
Carbon-ring microelectrode arrays for electrochemical imaging of single cell exocytosis: fabrication and characterization,https://pubs.acs.org/doi/abs/10.1021/ac3000368,"Y Lin, R Trouillon, MI Svensson, JD Keighron… ","Analytical …, 2012 ","Fabrication of carbon microelectrode arrays, with up to 15 electrodes in total tips as small as 
10–50 μm, is presented. The support structures of microelectrodes were obtained by pulling 
multiple quartz capillaries together to form hollow capillary arrays before carbon deposition. …",Maria Svensson,20
mTOR inhibition with rapamycin causes impaired insulin signalling and glucose uptake in human subcutaneous and omental adipocytes,https://www.sciencedirect.com/science/article/pii/S0303720712000548,"MJ Pereira, J Palming, M Rizell, M Aureliano… ","Molecular and cellular …, 2012 ","Rapamycin is an immunosuppressive agent used after organ transplantation, but its molecular 
effects on glucose metabolism needs further evaluation. We explored rapamycin effects on 
glucose uptake and insulin signalling proteins in adipocytes obtained via subcutaneous (n …",Maria Svensson,20
Individually addressable thin-film ultramicroelectrode array for spatial measurements of single vesicle release,https://pubs.acs.org/doi/abs/10.1021/ac4009385,"J Wang, R Trouillon, Y Lin, MI Svensson… ","Analytical …, 2013 ","Thin-film platinum ultramicroelectrode arrays (MEAs) with subcellular microelectrodes were 
developed for the spatial measurement of neurotransmitter release across single cells or 
clusters of single cells. MEAs consisting of 16, 25, and 36 square ultramicroelectrodes with …",Maria Svensson,20
"The immunosuppressive agents rapamycin, cyclosporin A and tacrolimus increase lipolysis, inhibit lipid storage and alter expression of genes involved in lipid …",https://www.sciencedirect.com/science/article/pii/S0303720712004820,"MJ Pereira, J Palming, M Rizell, M Aureliano… ","Molecular and cellular …, 2013 ","Cyclosporin A (CsA), tacrolimus and rapamycin are immunosuppressive agents (IAs) associated 
with insulin resistance and dyslipidemia, although their molecular effects on lipid metabolism 
in adipose tissue are unknown. We explored IAs effects on lipolysis, lipid storage and …",Maria Svensson,20
Differentiation of human induced pluripotent stem cells into brown and white adipocytes: role of Pax3,https://stemcellsjournals.onlinelibrary.wiley.com/doi/abs/10.1002/stem.1607,"T Mohsen‐Kanson, AL Hafner, B Wdziekonski… ","Stem …, 2014 ","Identification of molecular mechanisms involved in generation of different types of adipocytes 
is progressing substantially in mice. However, much less is known regarding characterization 
of brown (BAP) and white adipocyte progenitors (WAPs) in humans, highlighting the need …",Maria Svensson,30
"Cumulative risk, age at onset, and sex-specific differences for developing end-stage renal disease in young patients with type 1 diabetes: a nationwide population …",https://diabetes.diabetesjournals.org/content/59/7/1803.short,"A Möllsten, M Svensson, I Waernbaum, Y Berhan… ","Diabetes, 2010 ","OBJECTIVE This study aimed to estimate the current cumulative risk of end-stage renal 
disease (ESRD) due to diabetic nephropathy in a large, nationwide, population-based 
prospective type 1 diabetes cohort and specifically study the effects of sex and age at onset. …",Maria Svensson,30
"[HTML][HTML] End-stage renal disease and low level exposure to lead, cadmium and mercury; a population-based, prospective nested case-referent study in Sweden",https://link.springer.com/article/10.1186/1476-069X-12-9,"JN Sommar, MK Svensson, BM Björ, SI Elmståhl… ","Environmental …, 2013 ","Cadmium (Cd), lead (Pb), and mercury (Hg) cause toxicological renal effects, but the clinical 
relevance at low-level exposures in general populations is unclear. The objective of this 
study is to assess the risk of developing end-stage renal disease in relation to Cd, Pb, and Hg …",Maria Svensson,30
FKBP5 expression in human adipose tissue increases following dexamethasone exposure and is associated with insulin resistance,https://www.sciencedirect.com/science/article/pii/S0026049514001644,"MJ Pereira, J Palming, MK Svensson, M Rizell… ","Metabolism, 2014 ","Objective To study effects of dexamethasone on gene expression in human adipose tissue 
aiming to identify potential novel mechanisms for glucocorticoid-induced insulin resistance. 
Materials/methods Subcutaneous and omental adipose tissue, obtained from non-diabetic …",Maria Svensson,30
[HTML][HTML] Amperometric post spike feet reveal most exocytosis is via extended kiss-and-run fusion,https://www.nature.com/articles/srep00907,"LJ Mellander, R Trouillon, MI Svensson, AG Ewing ","Scientific reports, 2012 ","The basis for communication between nerve cells lies in the process of exocytosis, the fusion 
of neurotransmitter filled vesicles with the cell membrane resulting in release of the signaling 
molecules. Even though much is known about this process, the extent that the vesicles are …",Maria Svensson,30
The clinical impact of tumour‐infiltrating lymphocytes in colorectal cancer differs by anatomical subsite: A cohort study,https://onlinelibrary.wiley.com/doi/abs/10.1002/ijc.30869,"J Berntsson, MC Svensson… ","… journal of cancer, 2017 ","Accumulating evidence demonstrates an association between dense infiltration of lymphocytes 
and prognosis in colorectal cancer (CRC), but whether this prognostic impact differs by 
tumour location remains unknown. This study investigated the prognostic impact of cytotoxic …",Maria Svensson,30
Pan-cancer analysis of the mediator complex transcriptome identifies CDK19 and CDK8 as therapeutic targets in advanced prostate cancer,https://clincancerres.aacrjournals.org/content/23/7/1829.abstract,"J Brägelmann, N Klümper, A Offermann… ","Clinical Cancer …, 2017 ","Purpose: The Mediator complex is a multiprotein assembly, which serves as a hub for diverse 
signaling pathways to regulate gene expression. Because gene expression is frequently 
altered in cancer, a systematic understanding of the Mediator complex in malignancies could …",Maria Svensson,30
[HTML][HTML] Testing mutual exclusivity of ETS rearranged prostate cancer,https://www.nature.com/articles/labinvest2010179,"MA Svensson, CJ LaFargue, TY MacDonald… ","Laboratory …, 2011 ","Prostate cancer is a clinically heterogeneous and multifocal disease. More than 80% of 
patients with prostate cancer harbor multiple geographically discrete cancer foci at the time of 
diagnosis. Emerging data suggest that these foci are molecularly distinct consistent with the …",Maria Svensson,30
Albuminuria and renal function as predictors of cardiovascular events and mortality in a general population of patients with type 2 diabetes: a nationwide observational …,https://journals.sagepub.com/doi/abs/10.1177/1479164113500798,"MK Svensson, J Cederholm… ","Diabetes and …, 2013 ","Objective: Reduced renal function and albuminuria predict cardiovascular (CV) events and 
mortality in type 2 diabetes (T2D). In addition, we evaluated the role of co-existing congestive 
heart failure (CHF) and other CV risk factors on CV events in a large observational …",Maria Svensson,30
"3-Hydroxyisobutyrate, a strong marker of insulin resistance in type 2 diabetes and obesity that modulates white and brown adipocyte metabolism",https://diabetes.diabetesjournals.org/content/69/9/1903.abstract,"MS Nilsen, RÅ Jersin, A Ulvik, A Madsen, A McCann… ","Diabetes, 2020 ","Circulating branched-chain amino acids (BCAAs) associate with insulin resistance and type 
2 diabetes. 3-Hydroxyisobutyrate (3-HIB) is a catabolic intermediate of the BCAA valine. In 
this study, we show that in a cohort of 4,942 men and women, circulating 3-HIB is elevated …",Maria Svensson,30
[HTML][HTML] The prognostic value of Ki67 is dependent on estrogen receptor status and histological grade in premenopausal patients with node-negative breast cancer,https://www.nature.com/articles/modpathol2009167,"M Klintman, PO Bendahl, D Grabau, K Lövgren… ","Modern …, 2010 ","The aim of this study was to evaluate the prognostic value of Ki67 in relation to established 
prognostic factors in lymph node-negative breast cancer, and furthermore, whether the 
prognostic impact was dependent on estrogen receptor (ER) status and histological grade. In 200 …",Marie Klintman,10
[HTML][HTML] Ki67 proliferation in core biopsies versus surgical samples-a model for neo-adjuvant breast cancer studies,https://link.springer.com/article/10.1186/1471-2407-11-341,"Q Romero, PO Bendahl, M Klintman, N Loman… ","BMC cancer, 2011 ","An increasing number of neo-adjuvant breast cancer studies are being conducted and a 
novel model for tumor biological studies, the ""window-of-opportunity"" model, has revealed 
several advantages. Change in tumor cell proliferation, estimated by Ki67-expression in pre-…",Marie Klintman,10
"Changes in expression of genes representing key biologic processes after neoadjuvant chemotherapy in breast cancer, and prognostic implications in residual …",https://clincancerres.aacrjournals.org/content/22/10/2405.short,"M Klintman, R Buus, MCU Cheang, A Sheri… ","Clinical cancer …, 2016 ","Purpose: The primary aim was to derive evidence for or against the clinical importance of several 
biologic processes in patients treated with neoadjuvant chemotherapy (NAC) by assessing 
expression of selected genes with prior implications in prognosis or treatment resistance…",Marie Klintman,10
[HTML][HTML] Agreement between molecular subtyping and surrogate subtype classification: a contemporary population-based study of ER-positive/HER2-negative primary …,https://link.springer.com/article/10.1007/s10549-019-05378-7,"C Lundgren, PO Bendahl, Å Borg, A Ehinger… ","Breast cancer research …, 2019 ","Purpose Oestrogen receptor-positive (ER+) and human epidermal receptor 2-negative (HER2–) 
breast cancers are classified as Luminal A or B based on gene expression, but 
immunohistochemical markers are used for surrogate subtyping. The aims of this study were to …",Marie Klintman,10
"[HTML][HTML] The prognostic value of mitotic activity index (MAI), phosphohistone H3 (PPH3), cyclin B1, cyclin A, and Ki67, alone and in combinations, in node-negative …",https://journals.plos.org/plosone/article?id=10.1371/journal.pone.0081902,"M Klintman, C Strand, C Ahlin, S Beglerbegovic… ","PLoS …, 2013 ","Proliferation, either as the main common denominator in genetic profiles, or in the form of 
single factors such as Ki67, is recommended for clinical use especially in estrogen receptor-positive 
(ER) patients. However, due to high costs of genetic profiles and lack of reproducibility …",Marie Klintman,10
[HTML][HTML] Prognostic implications of the expression levels of different immunoglobulin heavy chain-encoding RNAs in early breast cancer,https://www.nature.com/articles/s41523-020-0170-2,"C Larsson, A Ehinger, S Winslow, K Leandersson… ","NPJ breast …, 2020 ","The extent and composition of the immune response in a breast cancer is one important 
prognostic factor for the disease. The aim of the current work was to refine the analysis of the 
humoral component of an immune response in breast tumors by quantifying mRNA expression …",Marie Klintman,10
"[HTML][HTML] The combination of Ki67, histological grade and estrogen receptor status identifies a low-risk group among 1,854 chemo-naïve women with N0/N1 primary …",https://springerplus.springeropen.com/articles/10.1186/2193-1801-2-111,"C Strand, M Bak, S Borgquist, G Chebil… ","…, 2013 ","The aim was to confirm a previously defined prognostic index, combining a proliferation 
marker, histological grade, and estrogen receptor (ER) in different subsets of primary N0/N1 
chemo-naïve breast cancer patients. In the present study, including 1,854 patients, Ki67 was …",Marie Klintman,10
"[HTML][HTML] Novel 18-gene signature for predicting relapse in ER-positive, HER2-negative breast cancer",https://breast-cancer-research.biomedcentral.com/articles/10.1186/s13058-018-1040-9,"R Buus, B Yeo, AR Brentnall… ","Breast Cancer …, 2018 ","Several prognostic signatures for early oestrogen receptor-positive (ER+) breast cancer have 
been established with a 10-year follow-up. We tested the hypothesis that signatures 
optimised for 0–5-year and 5–10-year follow-up separately are more prognostic than a single …",Marie Klintman,10
Early surrogate markers of treatment activity: where are we now?,https://academic.oup.com/jncimono/article-abstract/2015/51/24/944829,"M Klintman, M Dowsett ","Journal of the National Cancer Institute …, 2015 ","The assessment of new therapies in the adjuvant setting in early breast cancer requires large 
numbers of patients and many years of follow-up for results to be presented. Therefore, the 
neoadjuvant study setting, which allows for early prediction of treatment response in smaller …",Marie Klintman,10
"[HTML][HTML] A prospective, multicenter validation study of a prognostic index composed of S-phase fraction, progesterone receptor status, and tumour size predicts survival …",https://www.sciencedirect.com/science/article/pii/S0923753419369327,"M Klintman, F Nilsson, PO Bendahl, M Fernö… ","Annals of oncology, 2013 ","Background In a retrospective study on node-negative breast cancer, a prognostic index 
consisting of a proliferation factor, S-phase fraction (SPF), progesterone receptor status (PR), 
and tumour size identified one-third of patients as high risk, with a sixfold increased risk of …",Marie Klintman,10
Association between tumor tissue TIMP-1 levels and objective response to first-line chemotherapy in metastatic breast cancer,https://link.springer.com/article/10.1007/s10549-009-0483-1,"M Klintman, SØ Würtz, IJ Christensen, PB Hertel… ","Breast cancer research …, 2010 ","In a previous study from our laboratory, high tumor levels of tissue inhibitor of metalloproteinases-1 
(TIMP-1) have been associated with an adverse response to chemotherapy in metastatic 
breast cancer suggesting that TIMP-1, which is known to inhibit apoptosis, may be a new …",Marie Klintman,20
Significantly higher expression of vascular endothelial growth factor (VEGF) and shorter survival after recurrences in premenopausal node negative patients with triple …,https://cancerres.aacrjournals.org/content/69/2_Supplement/1077.short,"BK Linderholm, M Klintman, D Grabau, P Bendahl… ",2009 ,"#1077 Background: Triple-negative breast cancer (TNBC) amounts to approximately 15% of 
all breast cancer and is defined as lacking expression of oestrogen- and progesterone 
receptors (ER and PgR) and HER2 leaving chemotherapy as the only treatment option. The …",Marie Klintman,20
Long-Term Prognostication for 20 114 Women With Small and Node-Negative Breast Cancer (T1abN0),https://academic.oup.com/jncics/article-abstract/5/1/pkaa084/5912020,"D Jaraj, J Höijer, L Widman, J Ahlgren… ","JNCI cancer …, 2021 ","Background Although small, node-negative breast cancer (ie, T1abN0) constitutes 20% of 
all newly diagnosed breast cancers, data on prognosis and prognostic factors are limited. 
Methods We conducted a population-based cohort study including 20 114 Swedish women …",Marie Klintman,20
Androgen Receptor in Stage I-II Primary Breast Cancer–Prognostic Value and Distribution in Subgroups,https://ar.iiarjournals.org/content/37/12/6845.short,"E Niméus, E Folkesson, B Nodin, L Hartman… ","Anticancer …, 2017 ","Background/Aim: The value of androgen receptor (AR) in breast cancer has gained renewed 
interest as a prognostic and treatment predictive biomarker. The aims of this work were to 
study the associations and the prognostic value of AR in patients from two clinical cohorts. …",Marie Klintman,20
Biomarkers in residual disease after neoadjuvant chemotherapy of breast cancer predict long-term outcome,https://cancerres.aacrjournals.org/content/75/15_Supplement/5294.short,"R Buus, M Klintman, A Sheri, M Cheang, M Dowsett ",2015 ,"Aim: to assess the prognostic value of 24 candidate genes in residual breast cancers 
following neoadjuvant chemotherapy. Background Patients who do not achieve pathological 
complete response after neoadjuvant chemotherapy have increased risk of recurrence and …",Marie Klintman,20
Is the prognostic value of Ki-67 dependent on ER status and histological grade?.,https://cancerres.aacrjournals.org/content/69/2_Supplement/1076.short,"M Klintman, P Bendahl, D Grabau, K Lövgren… ",2009 ,"#1076 Purpose: Histological grade, tumor size, age, hormone receptor, and HER2 are established 
prognostic indicators for distant recurrences in node negative breast cancer. However, the 
role of the proliferation marker Ki-67 as a prognostic factor is still under debate. The aim …",Marie Klintman,20
Abstract PS18-10: Intratumoural heterogeneity in PgR expression: Molecular and prognostic significance,https://cancerres.aacrjournals.org/content/81/4_Supplement/PS18-10.short,"L Zabaglo, R Buus, E Schuster, B Yeo, M Klintman… ",2021 ,"Background: PgR is only expressed significantly in ER+ breast cancers and is generally 
considered a classical estrogen-sensitive protein, however, while ER+ cells are almost always 
expressed in a non-clustered pattern across the tumour bed, PgR+ cells form clusters or …",Marie Klintman,20
"The combination of Ki67, histological grade and estrogen receptor status identifies a low-risk group among 1,854 chemo-naïve women with N0/N1 primary breast …",https://portal.research.lu.se/portal/en/publications/the-combination-of-ki67-histological-grade-and-estrogen-receptor-status-identifies-a-lowrisk-group-among-1854-chemonaive-women-with-n0n1-primary-breast-cancer(623f91ca-b80f-443d-b6b3-bd68042e40ef).html,"C Forsare, M Bak, S Borgquist, G Chebil… ","…, 2013 ","The combination of Ki67, histological grade and estrogen receptor status identifies a low-risk 
group among 1,854 chemo-naŁve wo Page 1 The combination of Ki67, histological grade and 
estrogen receptor status identifies a low-risk group among 1,854 chemo-naïve women with …",Marie Klintman,20
[BOOK][B] The Prognostic and Treatment Predictive Value of Proliferation and TIMP-1 in Breast Cancer,https://lup.lub.lu.se/record/3734673,M Klintman ,2013 ,"Breast cancer is the most common tumour form and the second leading cause of death in solid 
tumours in women in the Western world. Despite improvements in the treatment, a considerable 
number of patients will relapse and die from their breast cancer. At the same time, a …",Marie Klintman,20
[HTML][HTML] Ki67 proliferation in core biopsies versus surgical samples-a model for neo-adjuvant breast cancer studies,http://oa.las.ac.cn/oainone/service/browseall/read1?ptype=JA&workid=JA201706290040621ZK,"S Borgquist, D Grabau, C Rose, L Rydén, C Ingvar… ",2011 ,"Background An increasing number of neo-adjuvant breast cancer studies are being conducted 
and a novel model for tumor biological studies, the"" window-of-opportunity"" model, has 
revealed several advantages. Change in tumor cell proliferation, estimated by Ki67-expression …",Marie Klintman,20
[CITATION][C] Validation of the predictive value of tissue inhibitor of metalloproteinases-1 for the response to first-line chemotherapy in metastatic breast cancer.,https://portal.research.lu.se/portal/en/publications/validation-of-the-predictive-value-of-tissue-inhibitor-of-metalloproteinases1-for-the-response-to-firstline-chemotherapy-in-metastatic-breast-cancer(f9a17bcf-3152-40d5-877f-e1013021472b).html,"SO Wuertz, M Klintman, IJ Christensen… ","Cancer …, 2009 ",… Marie Klintman …,Marie Klintman,30
Acknowledgement of reviewers 2011,https://search.proquest.com/openview/8486ecee732986e4a59f0f4e83993d3b/1?pq-origsite=gscholar&cbl=36266,"J Abrams, A Adams, F Ademuyiwa… ","Breast Cancer Res …, 2012 ","… Kleer Zdenek Kleibl Jennifer Klemp Kimberly Kline Marie Klintman Julia Knight U. Koch H. 
Phillip Koeffler Sadhna Kohli Zdenek Kolar Yi-Chi Kong Xiangyang Kong Anthony Kong 
Vassiliki Kotoula Konstantin Kousoulas Alwin Krämer Mikhail Krasil’nikov Hans Kreipe …",Marie Klintman,30
[PDF][PDF] Mammographic density. A marker of treatment outcome in breast cancer?,https://portal.research.lu.se/portal/files/84627613/Ida_Skarping_web.pdf,ID Skarping ,2020 ,"Background: Breast cancer is the most common cancer in women worldwide. Personalized 
cancer treatment requires predictive biomarkers, including image-based biomarkers. 
Mammographic density (MD) is a risk factor for developing breast cancer (BC). To study MD might …",Marie Klintman,30
[PDF][PDF] Mammographic density,https://lucris.lub.lu.se/ws/files/84627613/Ida_Skarping_web.pdf,IDA SKARPING ,lucris.lub.lu.se,"Background: Breast cancer is the most common cancer in women worldwide. Personalized 
cancer treatment requires predictive biomarkers, including image-based biomarkers. 
Mammographic density (MD) is a risk factor for developing breast cancer (BC). To study MD might …",Marie Klintman,30
Acknowledgement of reviewers 2018,https://link.springer.com/article/10.1007/s10549-019-05455-x,"SA Bapat, K Aalders, K Aaltonen, M Aapro… ","Breast Cancer Research …, 2019 ","The Editor, Marc Lippman, and Associate Editors: Stephen P. Ethier, Kevin S. Hughes, Kathy 
D. Miller, Steven A. Narod, and Ben H. Park would like to acknowledge the valuable 
contributions of the reviewers to the journal. We fully understand the burden and effort that are …",Marie Klintman,30
Способ прогнозирования эффективности химиотерапии при лечении рака молочной железы,https://elibrary.ru/item.asp?id=37431816,"ОИ Кит, ЮС Шатова, ЛЮ Владимирова, АЭ Лисутин… ",2015 ,"Изобретение относится к медицине, а именно к онкологии. Способ, включающий 
проведение исследования на этапе госпитализации. При проведении исследования 
определяют возраст пациентки в годах (X1), рост пациентки в см (Х2), вес пациентки в кг (Х3), …",Marie Klintman,30
