title,title_link,authors,publications,snippet,hcp_name,num_articles
Elevated plasma tissue inhibitor of metalloproteinase‐1 level predicts decreased response and survival in metastatic breast cancer,https://acsjournals.onlinelibrary.wiley.com/doi/abs/10.1002/cncr.22637,"A Lipton, SM Ali, K Leitzel, L Demers… ","… Journal of the …, 2007 ","BACKGROUND. Tissue inhibitors of metalloproteinase (TIMPs) have at least 2 different 
functions. They inhibit the catalytic activity of matrix metalloproteinases, and they act as growth 
factors. METHODS. Pretreatment ethylenediamine tetracetic acid plasma TIMP‐1 was assayed …",Marie Klintman,30
[HTML][HTML] Proactive Construction of an Annotated Imaging Database for Artificial Intelligence Training,https://link.springer.com/article/10.1007/s10278-020-00384-4,"CB Stadler, M Lindvall, C Lundström, A Bodén… ","Journal of digital …, 2021 ","Artificial intelligence (AI) holds much promise for enabling highly desired imaging diagnostics 
improvements. One of the most limiting bottlenecks for the development of useful clinical-grade 
AI models is the lack of training data. One aspect is the large amount of cases needed …",Marie Klintman,30
Training artificial neural networks directly on the concordance index for censored data using genetic algorithms,https://www.sciencedirect.com/science/article/pii/S0933365713000353,"J Kalderstam, P Edén, PO Bendahl, C Strand… ","Artificial intelligence in …, 2013 ","Objective The concordance index (c-index) is the standard way of evaluating the performance 
of prognostic models in the presence of censored data. Constructing prognostic models 
using artificial neural networks (ANNs) is commonly done by training on error functions which …",Marie Klintman,30
Correlation between MIB‐1 and other proliferation markers: clinical implications of the MIB‐1 cutoff value,https://acsjournals.onlinelibrary.wiley.com/doi/abs/10.1002/cncr.10458,"F Spyratos, M Ferrero‐Poüs, M Trassard, K Hacène… ","Cancer, 2002 ","BACKGROUND Cell proliferation is a major determinant of the biologic behavior of breast 
carcinoma. MIB‐1 monoclonal antibody is a promising tool for determining cell proliferation on 
routine histologic material. The objectives of this study were to compare MIB‐1 evaluation to …",Marie Klintman,30
[PDF][PDF] Farmaceutická péče u pacientů se substitucí železa při anémii,http://www.praktickelekarenstvi.cz/savepdfs/lek/2012/05/05.pdf,M ZAJÍCOVÁ ,"Praktické lékárenství, 2012 ","Pacienti přicházející do lékárny s předpisem na přípravky s obsahem solí železa trpí 
pravděpodobně anémií z nedostatku železa (sideropenická anémie). Lékárník ve chvíli samotné 
expedice nemůže znát příčinu jejího vzniku u daného pacienta, avšak jeho primárním úkolem je …",Marie Zajicova,10
[PDF][PDF] List of Investigators and Independent Ethics Committees,https://pdfs.semanticscholar.org/7667/30c93f7007e246cdaa4d95c2817e7966e100.pdf,"V Stanek, F nemocnice Brno, S Kozakova, P Urbanek… ",pdfs.semanticscholar.org,… Marie Zajicova Olomoucka 86 …,Marie Zajicova,10
"[PDF][PDF] Dispenzační minimum, jak by dnes mělo vypadat–obecný pohled praktikujícího lékárníka",https://www.praktickelekarenstvi.cz/pdfs/lek/2005/02/10.pdf,PDM Zajícová ,"Praktické lékárenství, 2005 ","O dispenzačním minimu je k dispozici maximum informací. Otázkou však je, zda-li je vždy 
pacientům poskytováno v příslušném rozsahu. Tady se mnozí kolegové v názoru liší. Co je 
nutné pacientovi říci, co je schopen pochopit, co je schopen dodržovat, v jakých případech …",Marie Zajicova,10
Persistent prevention of oxaliplatin-induced peripheral neuropathy using calmangafodipir (PledOx®): a placebo-controlled randomised phase II study (PLIANT),https://www.tandfonline.com/doi/abs/10.1080/0284186X.2017.1398836,"B Glimelius, N Manojlovic, P Pfeiffer, B Mosidze… ","Acta …, 2018 ","Purpose: Oxaliplatin causes disabling acute and chronic peripheral neuropathy. We explored 
the preventive effects of calmangafodipir, mimicking the mitochondrial enzyme manganese 
superoxide dismutase, thereby protecting cells from oxidative stress, in a placebo-controlled…",Marie Zajicova,10
Bakalářský koncert 29.4. 2015,https://is.jamu.cz/th/17244/hf_b,A ŠEVČÍKOVÁ ,2015 ,"Anotace Bakalářská práce „Váša Příhoda “pojednává o životě jednoho z nejvýznamnějších 
českých houslistů světového formátu, přibližuje jeho koncertní činnost, kompoziční a pedagogický 
přínos. Poskytuje také informace ohledně Institutu Váši Příhody, jeho činnosti, stejně …",Marie Zajicova,10
K RODINNÝM TRADICÍM NA OSTRAVSKU—DĚTI V RODINĚ,https://www.jstor.org/stable/42699533,V Tůmová ,"Český lid, 1969 ","Beim Studium des Familienlebens im Ostrauer Gebiet wurde den Kindern in der Familie, sowie 
den die Fürsorge um die Kinder und deren Erziehung betreffenden Traditionen bedeutende 
Aufmerksamkeit gewidmet. Die Entfaltung dieser Seiten des Familienlebens im Ostrauer …",Marie Zajicova,10
Extent of ipt gene expression and resulting amount of cytokinins affect activities of carboxylation enzymes in transgenic plants,https://link.springer.com/article/10.1007/s10535-005-0070-1,J Kveton ,"Biologia plantarum, 2006 ","Three types of transgenic plants of Solanum tuberosum cvs. Kamyk and Oreb, and Nicotiana 
tabacum cvs. Maryland Mammoth and Trapezond were selected according to intensity of 
introduced ipt gene expression and resulting amount of synthesised cytokinins (CKs). In …",Marie Zajicova,10
"11th annual meeting of EuroPharm Forum: report on a WHO meeting, Copenhagen, Denmark 3-5 October 2002",https://apps.who.int/iris/handle/10665/107464,World Health Organization ,2002 ,"… Lucie Driova and Marie Zajicova from the Czech Republic presented their twinning 
programme. Ms Driova reported on the current healthcare situation in the country. Ms Zajicova 
continued with more details on the actual twinning programme, informing about how it had …",Marie Zajicova,10
"[PDF][PDF] Marie Bohuňovská–spisovatelka, kurátorka, aktivistka.",https://is.muni.cz/th/mdpn1/bakalarska_prace.pdf,I Čepičková ,is.muni.cz,"V úvodu své bakalářské práce si dovolím být poněkud osobní. S paní Marií Bohuňovskou 
jsem se seznámila na podzim roku 2012. Tehdy jsem pracovala pro firmu, která paní Marii 
nabídla prostory k uspořádání její Vánoční výstavy. Pro mě osobně bylo důleţité, ţe jsem právě …",Marie Zajicova,10
[PDF][PDF] Superpotraviny–maca,http://www.praktickelekarenstvi.cz/savepdfs/lek/2021/01/15.pdf,"D Jankovská, I Garguláková ",praktickelekarenstvi.cz,"Současný životní styl ve vyspělých zemích světa s sebou přináší řadu zdravotních rizik, která 
přispívají ke vzniku civilizačních onemocnění. Mezi ně patří např. kardiovaskulární onemocnění, 
diabetes, obezita, rakovina, revmatická onemocnění, sexuální dysfunkce, chronický …",Marie Zajicova,10
[PDF][PDF] Výborným poradcom a odborníkom v jednom je pre nás práve lekárnik,https://unipharma.sk/wp-content/uploads/2013/04/Lekarnik-2015-02.pdf,XX Ročník ,unipharma.sk," Kvôli prideľovaniu kreditov Slovenskou lekárnickou komorou je potrebné, aby každý autor 
zaslal najneskôr do 30. 4. 2014 abstrakt príspevku (max. 600 slov) upravený podľa pokynov 
pre prispievateľov do časopisu Farmaceutický obzor doc. RNDr. M. Fulmekovej, CSc. a …",Marie Zajicova,17
[PDF][PDF] Charitativní a sociální práce,https://theses.cz/id/fkvvjo/BP_2010_11_09.pdf,P Chromková ,theses.cz,"… Marie Zajícová), která pracovala skupinovou i individuální prací jak s dětmi, tak s rodiči, 
popřípadě formou rodinné terapie. Třetí vedoucí (Mgr. Blanka Hrazdilová) přinesla do programu 
novou koncepci ve formě Programu Pět P, který prosazoval spíše práci individuální (dvojice …",Marie Zajicova,17
Hrabě Ferdinand Johann Verdugo (1635-1672) jako hejtman Žateckého kraje,https://dk.upce.cz/handle/10195/75536,D Leinveberová ,2020 ,"Předkládaná diplomová práce pojednává o Ferdinandovi Johannovi hraběti Verdugovi (1635-1672), 
se zaměřením na jeho práci v úřadu Žateckého krajského hejtmana za panský stav, ve 
kterém působil v letech 1665-1667. Práce se zabývá fungováním úřadu samotného. …",Marie Zajicova,17
"[PDF][PDF] Antonín Hulka a Maxmilián Pilát, poslanci z Valašska",https://is.muni.cz/th/wro01/Bakalarska_prace.pdf,J Hala ,is.muni.cz,"Anotace Bakalářská diplomová práce „Antonín Hulka a Maxmilián Pilát, poslanci z Valašska 
“seznamuje čtenáře se ţivotními příběhy dvou osobností, které působily na valašskomeziříčsku 
na přelomu 19. a 20. století, s jejich veřejnou činností v tomto regionu a zejména s jejich …",Marie Zajicova,17
Ženy na okraji společnosti v českých zemích a Velké Británii v letech 1900-1930-komparativní studie,https://otik.uk.zcu.cz/handle/11025/39525,M Kratochvílová ,2019 ,"Kriminalita něžného pohlaví reprezentuje v rámci ženských dějin velice specifické téma. 
Bádání v dané oblasti pak skrze podrobný výzkum a v neposlední řadě rovněž rekonstrukce 
konkrétních trestných činů páchaných v období 1900-1930 ve Velké Británii a českých zemích …",Marie Zajicova,17
Babická praxe v pacovské farnosti ve druhé polovině 19. století,https://dspace.cuni.cz/handle/20.500.11956/84130,K Kubíčková ,2015 ,"Ústředním tématem předkládané diplomové práce je babická praxe v prostředí pacovské 
farnosti v období druhé poloviny 19. století. Na základě studia odborné literatury a archivních 
dokumentů rozličné povahy, zejména pak matrik, byly zkoumány motivace žen k výběru …",Marie Zajicova,17
[PDF][PDF] 22. SYMPÓZIUM Z DEJÍN FARMÁCIE,https://unipharma.sk/wp-content/uploads/2016/11/Lekarnik-06_2017_web.pdf,"PDM Fedorová, RNDA Bartunek, PDU Ambrušová ",unipharma.sk,"Vážení lekárnici, revízni farmaceuti, čitatelia hlavnou témou časopisu, ktorý držíte práve v rukách, 
sú kontroly, ktoré zdravotné poisťovne vykonávajú v lekárňach, u poskytovateľov lekárenskej 
starostlivosti. Keď sa povie kontrola, mnohým hneď napadne sankcia. Čo to tá kontrola …",Marie Zajicova,17
,,,,,Marie Zajicova,17
,,,,,Karin Jannesson,0
,,,,,Karin Jannesson,0
,,,,,Karin Jannesson,0
To feel like an outsider: focus group discussions regarding the influence on sexuality caused by breast cancer treatment,https://onlinelibrary.wiley.com/doi/abs/10.1111/j.1365-2354.2011.01239.x,"K Klaeson, K Sandell… ","European Journal of …, 2011 ","KLAESON K., SANDELL K. & BERTERÖ CM (2011) European Journal of Cancer Care20, 
728–737 To feel like an outsider: focus group discussions regarding the influence on sexuality 
caused by breast cancer treatment The aftermath of breast cancer treatment, especially the …",Kicki Klaeson,10
Sexual health in primary health care–a qualitative study of nurses' experiences,https://onlinelibrary.wiley.com/doi/abs/10.1111/jocn.13454,"K Klaeson, L Hovlin, H Guvå… ","Journal of clinical …, 2017 ","Aim and objectives To illuminate nurses’ experiences and opportunities to discuss sexual 
health with patients in primary health care. Background Sexual health is a concept associated 
with many taboos, and research shows that nurses feel uncomfortable talking to patients …",Kicki Klaeson,10
Sexuality in the context of prostate cancer narratives,https://journals.sagepub.com/doi/abs/10.1177/1049732312449208,"K Klaeson, K Sandell… ","Qualitative Health …, 2012 ","In this study we explored how men diagnosed with prostate cancer experienced their sexuality 
from a lifeworld perspective. One essential meaning was identified: “having the elixir of life 
stolen.” This essential meaning had four constituents: “something that no longer exists,” “the …",Kicki Klaeson,10
Existential challenges in young people living with a cancer diagnosis,https://www.sciencedirect.com/science/article/pii/S1462388916300746,"I Odh, M Löfving, K Klaeson ","European Journal of Oncology Nursing, 2016 ","Purpose In Sweden, approximately 500 people between the ages of 15 and 39 are diagnosed 
with cancer each year. When someone is diagnosed with a life-threatening disease, existential 
issues are easily triggered. Young adults are in a developmental phase of life and are …",Kicki Klaeson,10
"Talking about sexuality: desire, virility, and intimacy in the context of prostate cancer associations",https://journals.sagepub.com/doi/abs/10.1177/1557988312458143,"K Klaeson, K Sandell… ","American journal of men's …, 2013 ","Prostate cancer and its outcomes are a real threat for health and well-being for men living in 
the Western world. The number of men with a diagnosis of prostate cancer, before the age of 
65 years, has increased in recent decades. The aim of this study was to explore how some …",Kicki Klaeson,10
Sexual identity following breast cancer treatments in premenopausal women,https://www.tandfonline.com/doi/abs/10.1080/17482620802130399,"K Klaeson, CM Berterö ","… Journal of Qualitative studies on Health …, 2008 ","The phenomenon in focus for this study was the sexual identity preserved in premenopausal 
women due to breast cancer treatments. During the last decade the methods of breast cancer 
treatments have become more aggressive and many women have had to undergo surgery…",Kicki Klaeson,10
Lived experiences and caring needs in young adults diagnosed with cancer,https://onlinelibrary.wiley.com/doi/abs/10.1111/nuf.12595,"MEJ Alander, K Klaeson, H Nyqvist… ","Nursing …, 2021 ","Aims and Objectives To explore the lived experience of young adults diagnosed with cancer 
and to increase our understanding of how to help them with their caring needs. Background 
Being diagnosed with cancer is normally related with an existential crisis. This indicates that …",Kicki Klaeson,10
The character of nursing students' critical reflection at the end of their education,https://www.diva-portal.org/smash/record.jsf?pid=diva2:1062922,"K Klaeson, M Berglund, S Gustavsson ","Journal of Nursing Education …, 2017 ","Background: In nursing education, theoretical and practical knowledge are intertwined and 
integrated in the prospective nurses’ lifeworld. To enable this, and to develop a critical 
reflective approach, students should adopt a critical attitude. This study aims to gain a deeper …",Kicki Klaeson,10
[HTML][HTML] Sexuality in the aftermath of breast and prostate cancer: Gendered experiences,https://www.diva-portal.org/smash/record.jsf?pid=diva2:459214,K Klaeson ,2011 ,"Sexuality is a sensitive topic in health care and is often interpreted through a natural scientific 
lens as just corresponding to sexual dysfunction and fertility problems. The purpose of this 
thesis was to describe sexuality and its outcomes in two cancer populations. Women with …",Kicki Klaeson,10
Sexuality in the aftermath of breast and prostate cancer,https://www.diva-portal.org/smash/get/diva2:459214/FULLTEXT03.pdf,K Klaeson ,"Gendered experiences. Linköping, 2011 ","The experience of sexuality in people with cancer diagnosis is a rather unexplored field. In 
this thesis the author describes sexuality from a lifeworld perspective in women with breast 
and men with prostate cancer. By conducting individual interviews combined with focus groups…",Kicki Klaeson,10
[BOOK][B] Att bli jämngammal med sin mamma: Unga kvinnors upplevelser av bröstcancerbehandling,https://www.diva-portal.org/smash/record.jsf?pid=diva2:733202,K Klaeson ,2005 ,"Syftet med denna studie var att beskriva unga kvinnors upplevelser av förtidig menopaus efter 
cytostatika-och/eller hormonbehandling. Ett ytterligare syfte var att beskriva hur sexualiteten 
upplevdes efter dessa behandlingar. Undersökningen genomfördes i två etapper med …",Kicki Klaeson,20
[HTML][HTML] Cancer och sexualitet vid bröst-och prostatacancer ur ett genusperpektiv| Application,https://www.researchweb.org/is/skas/ansokan/44731,C Berterö ,researchweb.org,"Den forskning som ligger till grund för kommande avhandling inom ämnet omvårdnad på 
institutionen för Medicin och Hälsa, Hälsouniversitetet i Linköping har en rakt igenom kvalitativ 
design. Syftet med avhandlingen är att kartlägga hur kvinnor och män upplevelser sin …",Kicki Klaeson,20
"[HTML][HTML] Cancer och sexualitet vid bröst-och prostatacancer ur ett genusperspektiv, del 2 männens erfarenhet| Application",http://www.researchweb.org/is/skaraborg/ansokan/95501,C Berterö ,researchweb.org,"Prostatacancer är mannens vanligaste cancerform och man räknar med att cirka 10 000 män 
drabbas varje år i Sverige. Majoriteten av de drabbade återfinns bland de äldre männen men 
de senaste årens massmediala uppmärksamhet har höjt medvetandet om denna sjukdom …",Kicki Klaeson,20
Låt hjärtat va me: sjuksköterskans stöd i egenvårdsåtgärder vid hjärtsvikt,https://www.diva-portal.org/smash/record.jsf?pid=diva2:533515,"C Nordström, BM Wennerholm ",2011 ,… Handledare: Lena Nilsson Examinator: Kicki Klaeson …,Kicki Klaeson,20
[BOOK][B] Naturbaserade aktiviteter i daglig verksamhet och gymnasiesärskola. En studie om personer som lär långsammare och om trädgårds-och naturbruksarbetets …,https://gupea.ub.gu.se/handle/2077/22215,M Niemi ,2010 ,"This study is about people with learning disabilities and nature-based activities. The study 
has an ethnographic approach and is based on observations and interviews at a daily 
activity center specializing in horticultural work and in an upper secondary special school …",Kicki Klaeson,20
[PDF][PDF] Syöpäsairaus ja seksuaalisuuden puheeksiottaminen: katsaus kirjallisuuteen,https://www.theseus.fi/bitstream/handle/10024/149325/Drebs_Satu%20ja%20Kokki_Tia.pdf?sequence=1,"S Drebs, T Kokki ",2018 ,"Opinnäytetyön tarkoituksena oli kuvata syöpää sairastavan potilaan kokemuksia 
seksuaalisuuden muuttumisesta sairauden aikana ja seksuaalisuuden puheeksiottamisesta. 
Tavoitteena oli tuottaa tietoa, jota voidaan hyödyntää seksuaalisuuden puheeksiottamisen …",Kicki Klaeson,20
[PDF][PDF] Syöpäsairaus ja seksuaalisuuden puheeksiotta-minen,https://core.ac.uk/download/pdf/161430986.pdf,"S Drebs, T Kokki ","Sairaanhoitaja (AMK), 2018 ","… Kicki Klaeson, Kerstin Sandell ja Carina Berterö 2013, Ruotsi Kvalitatiivinen ja induktiivinen … 
Kicki Klaeson, Kerstin Sandell ja Carina Berterö 2011, Ruotsi Laadullinen tutkimus …",Kicki Klaeson,20
A multimedia solution to motivate childhood cancer patients to keep up with cancer treatment,https://dl.acm.org/doi/abs/10.1145/3444685.3446262,"CWE Chai, BT Lau, AA Mahmud, MKT Tee ","Proceedings of the 2nd …, 2021 ","Childhood cancer is a deadly illness that requires the young patient to adhere to cancer 
treatment for survival. Sadly, the high treatment side-effect burden can make it difficult for 
patients to keep up with their treatment. However, childhood cancer patients can manage these …",Kicki Klaeson,20
[PDF][PDF] Män och kvinnors upplevelse av sexualitet efter behandling av prostata-och bröstcancer.:-en litteraturöversikt,https://www.diva-portal.org/smash/get/diva2:934901/FULLTEXT01.pdf,"J Hedström, R Gren ",2016 ,"Bakgrund: Sexualitet är en viktig del av hälsan. Behandlingar mot prostata-och bröstcancer 
kan påverka sexualiteten och därmed upplevelsen av hälsa. Syfte: Syftet var att beskriva 
hur män och kvinnor upplevde sin sexualitet efter att ha behandlats mot prostata-respektive …",Kicki Klaeson,20
Seksuell helse i sykepleien-snakk om det!,https://uis.brage.unit.no/uis-xmlui/handle/11250/2773006,"IÅ Thorsen, M Sørensen ",2021 ,"Bakgrunn: Vi er mer opplyste og kunnskapsrike enn før, og åpenheten og aksepten i dagens 
samfunn er større. Seksuell helse er en menneskerettighet og ses på som et grunnleggende 
behov. Likevel snakker sykepleiere lite om seksualitet i møte med pasienter. Hensikt: …",Kicki Klaeson,20
Det obekväma samtalet: en litteraturöversikt om sjuksköterskors kommunikation kring sexualitet,https://www.diva-portal.org/smash/record.jsf?pid=diva2:1391097,"E Löfstedt, E Mårtensson ",2020 ,"Bakgrund: Sexualitet är en grundläggande del av att vara människa som innefattar allt från 
kön och könsidentiteter till intimitet och reproduktion. Sexualitet i relation till hälsa, alltså 
sexuell hälsa, är ett tillstånd av fysiskt, psykiskt och socialt välbefinnande. Enligt …",Kicki Klaeson,30
Defining sexual outcomes after treatment for localized prostate carcinoma,https://acsjournals.onlinelibrary.wiley.com/doi/abs/10.1002/cncr.10848,"LR Schover, RT Fouladi, CL Warneke, L Neese… ","Cancer, 2002 ","BACKGROUND The objective of this survey was to identify factors associated with good 
sexual outcomes in a large group of survivors of localized prostate carcinoma. METHODS A 
postal survey was sent to 2636 men in the Cleveland Clinic Foundation's Prostate Cancer …",Kicki Klaeson,30
EN FÖRÄNDRAD IDENTITET: Sexualitetens påverkan i samband med bröstcancer. En litteraturöversikt,https://www.diva-portal.org/smash/record.jsf?pid=diva2:774508,"F Svanberg, T Shen ",2014 ,"Background: In Sweden 8000 women are afflicted by breast cancer every year. These women 
are subject to both physical and mental side effects and alternations. Aim: The objective of 
this literature review is to highlight how women in the case of breast cancer experience that …",Kicki Klaeson,30
[BOOK][B] Globalism and Gendering Cancer: Tracking the Trope of Oncogenic Women from the US to Kenya,https://www.taylorfrancis.com/books/mono/10.4324/9780429243387/globalism-gendering-cancer-miriam-kane-mara,MOK Mara ,2019 ,"… See Kicki Klaeson, Sandell, and Bertero, “Sexuality in the Context of Prostate Cancer 
Narratives” Qual Health Res 2012 22:1184 for use of the term “prostate narratives” in a 
different context. …",Kicki Klaeson,30
Livet efter prostatacancer,https://gupea.ub.gu.se/handle/2077/29334,"H Järbrink, M Samuelsson ",2012 ,"Antalet män som drabbas av prostatacancer i Sverige och i världen ökar, och kommer fortsätta 
öka markant även i framtiden. Män som erhåller någon form av behandling för sin prostatacancer 
löper stor risk för att drabbas av biverkningar så som inkontinens, erektil dysfunktion …",Kicki Klaeson,30
"[BOOK][B] Aftershock: The lived experience of chemotherapy, induced menopause for breast cancer survivors and its impact on their sexuality",https://search.proquest.com/openview/1786a9cb7ed4e2e3dfa9f6f79d9ca1b7/1?pq-origsite=gscholar&cbl=18750,E Norris-Walczak ,2011 ,"Being diagnosed with breast cancer in the prime of one's life is a life-altering experience for 
a woman. Treatment protocols, which may include surgery, chemotherapy, and radiation, are 
grueling and may affect many aspects of a woman's life, including her self-image, her sense …",Kicki Klaeson,30
Det obekväma samtalet: Sjuksköterskans upplevelse av att tala om sexuell hälsa,https://www.diva-portal.org/smash/record.jsf?pid=diva2:1305196,"T Lehnberg, S Mikaelsdotter ",2018 ,"Bakgrund: Den sexuella hälsan är en stor del av patientens livskvalitet och en viktig aspekt i 
det holistiska synsättet. Många sjukdomar och behandlingar kan ge upphov till sexuell 
dysfunktion. Studier visar att det finns ett samtalsbehov hos patienter gällande den sexuella …",Kicki Klaeson,30
Outcomes following primary total hip arthroplasty. With focus on the surgeon & surgeons' perceptions about feedback,https://gupea.ub.gu.se/handle/2077/62220,P Jolbäck ,2020 ,"Background Total hip arthroplasty is considered to be one of the most successful orthopaedic 
interventions of its generation and it has been proclaimed as “the operation of the century”. 
In this thesis, the focus will be on the surgeon and surgeons’ perceptions of individual …",Kicki Klaeson,30
Förlusten av ett bröst-om kroppsbild och sexualitet efter mastektomi. Bröstcancerdrabbade kvinnors tankar och upplevelser samt behov av stöd och kommunikation …,https://gupea.ub.gu.se/handle/2077/29048,"T Elola, S Jansson ",2012 ,"Bakgrund: Årligen insjuknar drygt 7000 kvinnor i bröstcancer i Sverige. Den främsta behandlingen 
är kirurgi, där mastektomi är en av metoderna. Vid mastektomi tas all bröstkörtelvävnad 
och vävnad i riktning mot axillen samt mamill och aerola bort. Förutom tankar kring …",Kicki Klaeson,30
[HTML][HTML] Parallel presentations,https://www.tandfonline.com/doi/full/10.1080/17507010600714977,S Angel ,"International Journal of Qualitative Studies on Health …, 2006 ","In this presentation, we want to show how a triangulated approach can capture the patients’ 
re-creation of meaning, even though it goes beyond, what people are able to answer. We 
present our narrative analysis of one case from a study, where we follow 12 persons during the …",Kicki Klaeson,30
Whole-genome sequencing of triple-negative breast cancers in a population-based clinical study,https://www.nature.com/articles/s41591-019-0582-4,"J Staaf, D Glodzik, A Bosch, J Vallon-Christersson… ","Nature medicine, 2019 ","Whole-genome sequencing (WGS) brings comprehensive insights to cancer genome 
interpretation. To explore the clinical value of WGS, we sequenced 254 triple-negative breast 
cancers (TNBCs) for which associated treatment and outcome data were collected between 2010 …",Martin Malmberg,10
