hcp_name,num_articles,title,authors,journal,publication_year,abstract,hcp_name_short,scraped_from
Jonas Bergh,4,longterm outcomes neoadjuvant versus adjuvant chemotherapy early breast cancer metaanalysis individual patient data randomised trials,"B Asselain, W Barlow, J Bartlett, J Bergh",the lancet,2018.0,background neoadjuvant chemotherapy (nact) early breast cancer breast-conserving surgery feasible likely eradicate micrometastatic disease chemotherapy given surgery. we investigated long-term,J Bergh,gs
Jonas Bergh,4,the clinical value somatic tp53 gene mutations 1794 patients breast cancer,"M Olivier, A Langer, P Carrieri, J Bergh, S Klaar",clinical cancer,2006.0,"to investigate clinical value somatic tp53 mutations breast cancer, assembled clinical molecular data 1,794 women primary breast cancer long-term follow-up tumor screened mutation exons 5 8 tp53 gene",J Bergh,gs
Jonas Bergh,4,complete sequencing p53 gene provides prognostic information breast cancer patients particularly relation adjuvant systemic therapy radiotherapy,"J Bergh, T Norberg, S Sjögren, A Lindgren",nature medicine,1995.0,"the complete coding region p53 gene sequenced 316 consecutively presented breast cancers, 97 lymph node positive 206 node negative. the p53 status related prognosis effect adjuvant therapy. in all, 69 individual",J Bergh,gs
Jonas Holm,25,prevalence consequences musculoskeletal symptoms symphony orchestra musicians vary gender crosssectional study,"H Paarup, J Baelum, J Holm",bmc,2011.0,"musculoskeletal symptoms common neck, back, upper limbs musicians. playing-related musculoskeletal disorders range 32% 87% tendency female musicians problems males. studies",J Holm,gs
Jonas Holm,25,occurrence coexistence localized musculoskeletal symptoms findings workattending orchestra musiciansan exploratory crosssectional study,"H Paarup, J Baelum, C Manniche, J Holm",bmc research,2012.0,"due ergonomic exposure musicians risk work-related musculoskeletal disorders neck, back, upper extremities. the literature confirms musculoskeletal problems anatomic regions orchestra musicians. an explorative cross-sectional study",J Holm,gs
Jonas Holm,25,mixed venous oxygen saturation predicts shortand longterm outcome coronary artery bypass grafting surgery retrospective cohort analysis,"J Holm, E Håkanson, F Vánky",british journal of,2011.0,"background complications inadequate haemodynamic state leading cause morbidity mortality cardiac surgery. unfortunately, commonly methods assess haemodynamic status documented respect outcome. the aim",J Holm,gs
Jonas Holm,25,euroscore ii nterminal probtype natriuretic peptide risk evaluation observational longitudinal study patients undergoing coronary artery bypass graft ,"J Holm, M Vidlund, F Vánky, Ö Friberg",british journal of,2014.0,"background postoperative heart failure remains major cause death cardiac surgery. as n-terminal pro-b-type natriuretic peptide (nt-probnp) predictor postoperative heart failure, aim evaluate preoperative nt-probnp provide additional",J Holm,gs
Jonas Holm,25,increasing rate angiotensinconverting enzyme inhibitorrelated upper airway angiooedema,"J Holm, T Ovesen",dan med j,2012.0,"introduction: the objective study evaluate increased use angiotensin-converting enzyme inhibitors affected rate upper airway angiooedema (ae). in addition, evaluated presentation treatment patients upper airway",J Holm,gs
Jonas Holm,25,mixed venous oxygen saturation prognostic marker surgery aortic stenosis,"J Holm, R Håkanson, F Vánky",acta,2010.0,"background: adequate monitoring hemodynamic state essential cardiac surgery vital medical decision making, particularly concerning hemodynamic management. unfortunately, commonly methods assess hemodynamic state",J Holm,gs
Jonas Holm,25,rise fall ntprobnp aortic valve intervention,"H Hultkvist, J Holm, R Svedjeholm, F Vánky",open heart,2018.0,"objectives to dynamics n-terminal pro-b-type natriuretic peptide (nt-probnp) preoperative evaluation 6-month follow-up patients undergoing aortic valve intervention, evaluate nt-probnp regard 1-year mortality. methods at preoperative",J Holm,gs
Jonas Holm,25,preoperative ntprobnp independently predicts outcome patients acute coronary syndrome undergoing cabg,"J Holm, M Vidlund, F Vanky, Ö Friberg",scandinavian,2013.0,objectives. the predictive value preoperative n-terminal pro-b-type natriuretic peptide (nt-probnp) evaluated patients acute coronary syndrome undergoing coronary artery bypass grafting (cabg). design. as substudy clinical trial 383 patients acute,J Holm,gs
Jonas Holm,25,ntprobnp postoperative heart failure surgery aortic stenosis,"H Jiang, F Vánky, H Hultkvist, J Holm, Y Yang",open,2019.0,objective postoperative heart failure (phf) aortic valve replacement (avr) aortic stenosis (as) initially appear mild transient long-term consequences. methods assess phf documented. we studied association n-…,J Holm,gs
Jonas Holm,25,impact underlying heart disease se utility preoperative ntprobnp adult cardiac surgery,"H Jiang, H Hultkvist, J Holm, F Vanky, Y Yang",plos one,2018.0,"objective the primary aim investigate role underlying heart disease preoperative nt-probnp levels patients admitted adult cardiac surgery, adjusting known confounders age, gender, obesity renal function. the second aim",J Holm,gs
Jonas Holm,25,biomarker dynamics cardiac surgery prospective observational study mrproadm mrproanp hscrp spselectin plasma levels perioperative ,"J Holm, I Cederholm, U Alehagen, T Lindahl",biomarkers,2020.0,"background: for biomarkers cardiac surgery, lack knowledge normal dynamics plasma levels perioperative course. the aim study investigate perioperative dynamics mr-proadm, mr-proanp, hs-crp sp-…",J Holm,gs
Jonas Holm,25,improvement cycloid psychosis following electroconvulsive therapy,"J Holm, O Brus, U Båve, M Landen",nordic journal of,2017.0,"background: the treatment choice cycloid psychosis traditionally electroconvulsive therapy (ect), lack studies effectiveness. aims: the primary aim register study determine rates remission response ect",J Holm,gs
Jonas Holm,25,pseudomonas aeruginosa patients cystic fibrosis strongly associated chronic obstructive lung disease,"J Holm, O Hilberg, N Lauritsen",dan med j,2013.0,"dan med j 2013; 609 (6): a4636 2 danish medical journal dan med j 60/6 june 2013 computed tomography (ct) thorax, number lung disease-related admissions mortality. finally, deterioration lung function evaluated comparing change forced",J Holm,gs
Jonas Holm,25,utility ntprobnp objective marker postoperative heart failure coronary artery bypass surgery prospective observational study,"H Jiang, J Holm, Ö Friberg",perioperative,2021.0,postoperative heart failure (phf) main cause mortality cardiac surgery unbiased evaluation phf difficult. we investigated utility postoperative nt-probnp objective marker phf coronary artery bypass surgery (cabg). prospective study,J Holm,gs
Jonas Holm,25,copeptin release cardiac surgerya new biomarker identify risk patients,"J Holm, Z Szabó, U Alehagen, T Lindahl",journal of cardiothoracic,2018.0,objective to dynamics copeptin open cardiac surgery perioperative course. design prospective cohort study. setting single tertiary hospital. participants twenty patients scheduled open cardiac surgery procedures cardiopulmonary bypass (…,J Holm,gs
Jonas Holm,25,attitudes barriers concerns regarding telemedicine among swedish primary care physicians a qualitative study,"H Glock, V Nymberg, B Bolmsjö, J Holm",journal of general,2021.0,"purpose the primary care physician’s traditional patient contacts challenged rapidly accelerating digital transformation. in quantitative survey analysis based theory planned behavior, high behavioral intention use telemedicine swedish",J Holm,gs
Jonas Holm,25,upper limb disorders biomedical laboratory workers pipettes,"J Holm, O Mortensen, F Gyntelberg",cogent medicine,2016.0,"laboratory workers engaged biomedical work process series specimens repetitive static manual activities. the widespread use stamp pipettes particular suspected entail upper-limb disorders. our primary aim test, cumulated pipette",J Holm,gs
Jonas Holm,25,the s100b substudy glutamics trial glutamate infusion associated sustained elevation plasma s100b coronary surgery,"M Vidlund, J Holm, E Håkanson, Ö Friberg",clinical nutrition,2010.0,"background & aims concerns raised potential neurological injury related exogenous glutamate. in cardiac surgery glutamate administered putative cardioprotective agent cardioplegia intravenous infusion. in glutamics trial,",J Holm,gs
Jonas Holm,25,post hoc analysis glutamicstrial intravenous glutamate infusion use inotropic drugs cabg,"M Vidlund, B Tajik, E Håkanson, Ö Friberg, J Holm",bmc,2015.0,intravenous glutamate reduced risk developing severe circulatory failure isolated coronary artery bypass graft surgery (cabg) acute coronary syndrome (acs) double-blind randomised clinical trial (glutamics-clinicaltrials.gov identifier: nct00489827 ).,J Holm,gs
Jonas Holm,25,local biomarkers involved interplay obesity breast cancer,"J Holm, A Rosendahl, S Borgquist",cancers,2021.0,"simple summary breast cancer second common cancer women worldwide. the risk developing breast cancer depends mechanisms, age, heredity, reproductive factors, physical inactivity, obesity. obesity increases risk breast",J Holm,gs
Jonas Holm,25,early experience implantation new pulsatile total artificial heart tah pig,"Z Szabó, J Holm, A Najar, G Hellers",journal of clinical &,2017.0,the shortage donor hearts physiological impact pulsatile perfusion driven technical innovation research efforts create positive displacement total artificial heart produce pulsatile flow reasonable size long-term assist chronic heart,J Holm,gs
Jonas Holm,25,modest associations selfreported physical workload neck trouble populationbased twin control study,"J Holm, J Hartvigsen, S Lings, K Kyvik",international archives of,2013.0,"objectives to investigate relationship self-reported physical workload neck trouble (nt) twins. additionally, explore relationship physical workload nt influenced genetic factors. methods a twin control study performed",J Holm,gs
Jonas Holm,25,the impact glutamate infusion postoperative ntprobnp patients undergoing coronary artery bypass surgery randomized study,"H Jiang, J Holm, M Vidlund, F Vanky, Ö Friberg",journal of translational,2020.0,"background glutamate, key intermediate myocardial metabolism, enhance myocardial recovery ischemia possibly reduce incidence severity postoperative heart failure coronary artery bypass surgery (cabg). n-terminal pro-b-type natriuretic",J Holm,gs
Jonas Holm,25,forgiftning med muldvarpegasningsmidlet aluminiumfosfid,"T Andersen, J Holm, T Andersen",ugeskr laeger,1996.0,"i danmark anvendes aluminiumfosfid (alp)–den toksiske bestanddel mortalin muldvarpe-og mosegrisegas–til bekæmpelse af såvel disse dyr som til gasning af skadedyr korn-og frølagre. i perioden 1970-1990 har giftinformationen, rigshospitalet, registreret 13 mulige,",J Holm,gs
Jonas Holm,25,a new total artificial heart concept allowing replacement support native heart,"H Ahn, J Holm, A Najar, G Hellers",journal of clinical &,2018.0,a total artificial heart (tah) typically bridge time heart transplantation. a device designed robert jarvik improved years syncardia™ successful commercially available tah far. since,J Holm,gs
Jörn Schneede,7,biological clinical implications mthfr c677t polymorphism,"P Ueland, S Hustad, J Schneede, H Refsum",trends in,2001.0,the enzyme methylenetetrahydrofolate reductase (mthfr) directs folate species dna synthesis homocysteine (hcy) remethylation. the common mthfr c677t polymorphism affects activity enzyme folate distribution. under conditions,J Schneede,gs
Jörn Schneede,7,vkorc11639g a cyp2c9 ephx1 691a g genotype body weight age important predictors warfarin maintenance doses patients ,"Q Gu, Y Kong, J Schneede, Y Xiao, L Chen",european journal of,2010.0,"objective to investigate contribution genetic polymorphisms vitamin k epoxide reductase complex subunit 1 gene vkorc1-1639g>a, cytochrome p450 2c9 gene (cyp2c9), ephxi, clinical factors warfarin sensitivity southwest chinese han patients",J Schneede,gs
Jörn Schneede,7,plasma concentrations homocysteine aminothiol compounds related food intake healthy human subjects,"A Guttormsen, J Schneede, T Fiskerstrand",the journal of,1994.0,"we investigated total, free protein-bound plasma homocysteine, cysteine cysteinylglycine 13 subjects aged 24–29 y breakfast 0900 h containing 15–18 g protein dinner 1500 h containing ∼50 g protein. twelve subjects normal fasting",J Schneede,gs
Jörn Schneede,7,quantification methylmalonic acid human plasma hydrophilic interaction liquid chromatography separation mass spectrometric detection,"H Lakso, P Appelblad, J Schneede",clinical chemistry,2008.0,background: measurement methylmalonic acid (mma) serum plasma useful diagnosing cobalamin deficiency. we developed method quantifying mma plasma based hydrophilic interaction liquid chromatography (hilic) single-stage negative,J Schneede,gs
Jörn Schneede,7,the methylenetetrahydrofolate reductase 677c t polymorphism modulator b vitamin network major effects homocysteine metabolism,"S Hustad, Ø Midttun, J Schneede, S Vollset",the american journal of,2007.0,"folates carriers one-carbon units metabolized 5,10-methylenetetrahydrofolate reductase (mthfr) enzymes use riboflavin, cobalamin, vitamin b6 cofactors. these b vitamins essential remethylation transsulfuration",J Schneede,gs
Jörn Schneede,7,vitamin b6 colorectal cancer risk prospective populationbased study 3 distinct plasma markers vitamin b6 status,"B Gylling, R Myte, J Schneede",american journal of,2017.0,"background: higher plasma concentrations vitamin b-6 marker pyridoxal 5′-phosphate (plp) associated reduced colorectal cancer (crc) risk. inflammatory processes, including vitamin b-6 catabolism, explain findings. objective: we",J Schneede,gs
Jörn Schneede,7,multianalyte quantification vitamin b6 b2 species nanomolar range human plasma liquid chromatographytandem mass spectrometry,"Ø Midttun, S Hustad, E Solheim, J Schneede",clinical,2005.0,"background: homocysteine, risk factor cardiovascular disease, cognitive disorders, pregnancy complications, exists point metabolic convergence b vitamins, including vitamins b 6 b 2 (riboflavin). measurement forms",J Schneede,gs
Judith Bjöhle,14,gene expression profiling spares early breast cancer patients adjuvant therapy derived validated populationbased cohorts,"Y Pawitan, J Bjöhle, L Amler",breast cancer,2005.0,"adjuvant breast cancer therapy significantly improves survival, overtreatment undertreatment major problems. breast cancer expression profiling far mainly identify women poor prognosis candidates adjuvant therapy",J Bjöhle,gs
Judith Bjöhle,14,radiation pneumonitis breast cancer irradiation analysis complication probability relative seriality model,"G Gagliardi, J Bjöhle, I Lax, A Ottolenghi",international journal of,2000.0,background: toxicity respiratory common radiotherapy thoracic tumors; breast cancer patients represent groups long expected survival. the quantification lung tissue response irradiation important,J Bjöhle,gs
Judith Bjöhle,14,assessment early response biomarkers relation longterm survival patients her2negative breast cancer receiving neoadjuvant chemotherapy plus ,"S Kimbung, I Markholm, J Bjöhle",journal of cancer,2018.0,"pathologic complete response (pcr) predictor favorable outcome neoadjuvant treatment early breast cancer. modulation gene expression provide early readouts biological activity prognosis, offering possibility timely response‐guided",J Bjöhle,gs
Judith Bjöhle,14,neoadjuvant trastuzumab pertuzumab docetaxel vs trastuzumab emtansine patients erbb2positive breast cancer phase 2 randomized clinical trial,"T Hatschek, T Foukakis, J Bjöhle, T Lekberg",jama,2021.0,"importance trastuzumab emtansine (t-dm1) presently approved treatment advanced breast cancer incomplete response neoadjuvant therapy, potential t-dm1 monotherapy far unknown. objective to assess pathologic complete response",J Bjöhle,gs
Judith Bjöhle,14,hormonereplacement therapy influences gene expression profiles associated breastcancer prognosis cohort study,"P Hall, A Ploner, J Bjöhle, F Huang",bmc,2006.0,"postmenopausal hormone-replacement therapy (hrt) increases breast-cancer risk. the influence hrt biology primary tumor, however, understood. we obtained breast-cancer gene expression profiles affymetrix human genome u133a arrays.",J Bjöhle,gs
Judith Bjöhle,14,multilevel gene expression signatures binary outperform ki67 long term prognostication breast cancer patients,"N Tobin, L Lindström, J Carlson, J Bjöhle",molecular,2014.0,"proliferation-related gene signatures proposed aid breast cancer management providing reproducible prognostic predictive information patient-by-patient basis. it unclear however, demanding assessment cell division rate (as",J Bjöhle,gs
Judith Bjöhle,14,no difference dose distribution organs risk postmastectomy radiotherapy breast implant reconstruction,"A Liljegren, D Unukovych, G Gagliardi, J Bjöhle",radiation,2014.0,"the aim study quantify variation doses organs risk (ipsilateral lung heart) clinical target volume (ctv) presence breast implants. in retrospective cohort study, patients identified national breast cancer register.",J Bjöhle,gs
Judith Bjöhle,14,postmastectomy radiation therapy implantbased reconstruction safe terms clinical target volume coverage survivala matched ,"J Bjöhle, E Onjukka, N Rintelä, S Eloranta",radiotherapy and,2019.0,"background purpose patients breast cancer receiving mastectomy institution offered immediate breast reconstruction (ibr). ibr impact optimisation radiation therapy (rt). therefore, aimed evaluate clinical target volume (ctv…",J Bjöhle,gs
Judith Bjöhle,14,clinical evaluation quantec guidelines predict risk cardiac mortality breast cancer patients,"V Moiseenko, J Einck, J Murphy, J Ödén, J Bjöhle",acta,2016.0,methods we retrospectively identified patients received rt left breast cancer tangent fields 2010 2014 university california san diego (ucsd) karolinska university hospital stockholm. institutional ethics board approvals,J Bjöhle,gs
Judith Bjöhle,14,can axillary dissection avoided improved molecular biological diagnosis,"T Lindahl, G Engel, J Ahlgren, S Klaar, J Bjöhle",acta,2000.0,axillary dissection presently routine staging procedure management breast cancer. the use adjuvant systemic treatment largely based diagnosis axillary metastases. routine axillary dissection leads acute chronic side-effects large,J Bjöhle,gs
Judith Bjöhle,14,abstract p31114 is pathologic complete response pcr valid marker outcome large breast cancer clinical results neoadjuvant trial ,"T Hatschek, J Bjöhle, E Lidbrink, T Lekberg, N Loman",,2015.0,"background: several randomized trials proven preoperative chemotherapy equivalent adjuvant treatment, allows clinical radiological assessment efficacy vivo. recent results response-guided neoadjuvant therapy favorable policy",J Bjöhle,gs
Judith Bjöhle,14,abstract p20502 preliminary translational results promix phase ii trial preoperative chemotherapy addition bevacizumab large operable ,"N Loman, I Johansson, J Bjöhle, J Frisell, T Lekberg",,2015.0,background: preoperative chemotherapy breast cancer (bc) provides unique possibilities evaluate effects therapy studying response changes tumor course treatment. a pathologic complete response (pcr) correlates positively long term,J Bjöhle,gs
Judith Bjöhle,14,erratum multilevel gene expression signatures binary outperform ki67 long term prognostication breast cancer patientsmolonc 8 2014 741 ,"N Tobin, L Lindström, J Carlson, J Bjöhle",molecular,2014.0,"… carlson, 1 judith bjöhle, 1 jonas bergh, 1 , 4 kristian wennmalm 1",J Bjöhle,gs
Judith Bjöhle,14,doppler screening av ockult levermetastasering hos patienter med känd tumörsjukdom,"J Bjöhle, A Elvin, N Wilking, I Meyer",hygiea,1997.0,,J Bjöhle,gs
Karolina Larsson,28,synthesis polycaprolactonegrafted microfibrillated cellulose use novel bionanocompositesinfluence graft length mechanical properties,"H Lonnberg, K Larsson, T Lindstrom",applied materials &,2011.0,"in present work, microfibrillated cellulose (mfc) bleached sulfite softwood dissolving pulp utilized reinforce poly(ε-caprolactone) (pcl) biopolymer matrix. to improve dispersibility hydrophilic mfc nonpolar matrix interfacial",K Larsson,gs
Karolina Larsson,28,polylactide latexnanofibrillated cellulose bionanocomposites high nanofibrillated cellulose content nanopaper network structure prepared papermaking ,"K Larsson, L Berglund, M Ankerfors",journal of applied,2012.0,"previous attempts use polylactide (pla) latex particles nanofibrillated cellulose (nfc) papermaking processing limited low nfc content. in present study, bionanocomposite material successfully produced pla latex nfc. the",K Larsson,gs
Karolina Larsson,28,representation 3d cadastral boundariesfrom analogue digital,"K Larsson, J Paasch, J Paulsson",land use policy,2020.0,this paper discusses problems challenges concerning process conversion 2d analogue cadastral boundary plans 3d digital information based experiences research project visualization 3d property boundaries sweden. an area,K Larsson,gs
Karolina Larsson,28,early menopause low body mass index smoking independent risk factors developing giant cell arteritis,"K Larsson, D Mellström, C Nordborg, A Odén",annals of the,2006.0,"objective: to assess female sex hormone related variables group women biopsy positive giant cell arteritis control group. methods: 49 women biopsy positive giant cell arteritis, aged 50 69 years time diagnosis, answered questionnaire",K Larsson,gs
Karolina Larsson,28,phylogeny catenulida support platyhelminthes,"K Larsson, U Jondelius",organisms diversity & evolution,2008.0,"molecular studies shown platyhelminthes polyphyletic, placing rhabditophora lophotrochozoa, acoela nemertodermatida separate early bilaterian branches. however, little evidence support position catenulida,",K Larsson,gs
Karolina Larsson,28,visualization 3d property data assessment impact rendering attributes,"S Seipel, M Andrée, K Larsson, J Paasch",of geovisualization and,2020.0,"visualizations 3d cadastral information incorporating intrinsically spatial non-spatial information examined here. the design visualization prototype linked real-case 3d property information. in interview domain experts, functional visual",K Larsson,gs
Karolina Larsson,28,conversion 2d analogue cadastral boundary plans 3d digital information problems challenges illustrated swedish case,"K Larsson, J Paasch, J Paulsson",fig 3d cadastre workshop; 2-4,2018.0,the possibility forming 3d property units existed long time sweden. the legislation introduced 2004 2009 addition apartment ownership (condominium) added. even demand 3d property formation high,K Larsson,gs
Karolina Larsson,28,dna taxonomy swedish catenulida platyhelminthes phylogenetic framework catenulid classification,"K Larsson, A Ahmadzadeh, U Jondelius",organisms diversity & evolution,2008.0,"specimens catenulida collected 34 localities sweden. we 18s rdna, 28s rdna, its-5.8s, cytochrome oxidase i (coi) nucleotide sequences infer phylogeny parsimony jackknifing bayesian analysis. our dataset contained 74 ingroup",K Larsson,gs
Karolina Larsson,28,the supramolecular structure celluloserich wood pulps determinative factor enzymatic hydrolysability,"F Aldaeus, K Larsson, J Srndovic, M Kubat",cellulose,2015.0,"the enzymatic hydrolysability industrial pulps, lab pulps, microcrystalline cellulose powder assessed commercial cellulolytic enzymes. to gain insight factors influence hydrolysability, thorough characterization",K Larsson,gs
Karolina Larsson,28,cleavage nemertoderma westbladi nemertodermatida phylogenetic significance,"U Jondelius, K Larsson, O Raikova",zoomorphology,2004.0,recent phylogenetic analyses ribosomal protein coding nuclear genes place marine worms nemertodermatida oldest lineages bilaterian animals. we studied early embryonic cleavage nemertoderma westbladi provide,K Larsson,gs
Karolina Larsson,28,comparison breast cancer surrogate subtyping closedsystem rtqpcr breast cancer assay immunohistochemistry 100 core needle ,"S Janeva, T Parris, S Nasic, S Lara, K Larsson",bmc cancer,2021.0,"routine clinical management breast cancer (bc) currently depends surrogate subtypes according estrogen- (er) progesterone (pr) receptor, ki-67, her2-status. however, growing demand reduced immunohistochemistry (ihc) turnaround",K Larsson,gs
Karolina Larsson,28,selfreported life satisfaction response style differences children chile sweden,"L Liberman, K Larsson, M Altuzarra, L Öst",journal of child and,2015.0,"the purpose current study assess self-perceived life satisfaction chilean swedish children. the total sample consisted non-clinical sample 1,352 school children 8 14 years age. analyses carried compare children’s",K Larsson,gs
Karolina Larsson,28,report freshwater catenulida platyhelminthes sweden description new species,"K Larsson, W Willems",zootaxa,2010.0,"this contribution reports swedish species freshwater catenulida, group free-living, small flatworms. a total 13 species collected 33 localities country. four species, belonging taxon stenostomum, new",K Larsson,gs
Karolina Larsson,28,stereological study neovascularization temporal arteritis,"C Nordborg, K Larsson, E Nordborg",the journal of rheumatology,2006.0,"objective: as giant cell arteritis (gca) progresses, newly formed microvessels main sites leukocyte-endothelial cell interaction. our aim stereologically map distribution microvessels temporal arterial wall assess relationship",K Larsson,gs
